disallow,ممنوع قرار دينا ـ نامنظور کرنا
disappear,غائب هونا ـ ناپيد هونا
disappearance,گمشدگي ـ غيبت
disappoint,وعده خلافي کرنا ـ نااميد کرنا ـمايوسي کرنا
disappointing,مايوس ک€
disappointment,مايوسي
disapprobation,نفرت ـ ناخوشي
disapproval,نارضامندي ـ ترديد
disapprove,ناپسند کرنا ـمذمت کرنا
disapprovingly,ناپسنديدگي سے
disarm,هتھيار چھين لينا
disarmament,سامان حرب پر پابندي
disarmer,هتھيار چھيننے والا
disarrange,نے ترتيب کرنا ـ الٹ پلٹ کرنا
disarrangement,گڑ بڑ ـ ابتري
disarray,برهنگي ـ ابتري
disassociate,الگ کرنا ـعليحده کرنا
disassociation,عليحدگي
disaster,شامت ـ آفت ـ بدنصيبي
disastrous,آفت انگيز ـ مصيبت خيز
disavow,انکار کرنا ـ ترديد کرنا
disavowal,نامنظوري ـ ترديد
disband,جواب دينا ـ موقوف کرنا
disbarment,اخراج
disbelief,انکار ـ بے اعتباري
disbelieve,يقين نه کرنا ـ نه ماننا
disbeliever,بے ايمان ـ بے يقين ـ کافر
disbelieving,بے اعتباري
disburden,بوجھ هلکا کرنا ـ سبکدوش کرنا
disburse,خرچ کرناـ صرف کرنا
disbursement,خرچ ـ صرف
disburser,خرچ کرنے والا ـ صرف کرنے والا
discard,بد رنگي ميں نکالنا ـ بر طر ف کرنا
discern,معلوم کرناـ فرق نکالنا ـ امتياز کرنا ـتاڑ لينا ـ جان لينا
discernable,قابل شناخت
discerner,شناخت کرنے والا
discernible,قابل امتياز
discerning,دانشمند ـ هوشيار
discernment,فهم ـ ذکاوت ـ فراست
discharge,سبکدوش کرنا ـموقوف کرنا ـبندوق چلانا
dischargeable,برطرف کرنے کے قابل
discharger,برطرف کرنے والا
disciple,مريد ـ چيلا ـ شاگرد
disciplinarian,مودبـ سخت گير  ـ قواعد دا€
disciplinary,تاديبي ـ انضباطي
discipline,نظم و ضبط ـ ادب ـ تهذيب ـ تابعداري
discipliner,نظم و ضبط بر قرار رکھنے والا
disclaim,دعوي ترک کرناـ انکار کرنا
disclaimant,انکار کرنے والا
disclaimer,انکار ـ اعلانـ بے تعلقي کا اظهار
disclamation,انکار
disclose,افشا کرنا ـدکھانا ـکھولنا ـظاهر هونا
discloser,ظاهر کرنے والا
disclosing,ظاهر کرنا
disclosure,اعلان ـ اظهار
discolor,رنگ بدلنا ـ بد رنگ کرنا
discoloration,بد رنگي
discomfit,مغلوب کرنا ـپريشان کرنا
discomfiture,مات ـ هار ـ شکست
discomfort,دکھ ـ بے چيني
discomforting,بے چيني ـ تکليف
discompose,الجھن ميں ڈالنا ـ مضطرب کربا
discomposure,بے چيني ـ بے کلي
disconcert,کام بگاڑ دينا ـ پريشان کرنا
disconcerting,بد حواسي
disconcertingly,بے چيني سے
disconcertment,بے چيني
disconnect,الگ کرنا ـمنقطع کرنا ـکاٹ دينا
disconnected,جدا کيا هوا ـمنقطع
disconnecting,عليحدگي
disconnection,بے تعلقي
disconsolate,اداس ـ دلگير ـ فکر مند
disconsolately,افسردگي سے
discontent,بے چيني ـ بے قناعي ـ بے قرار
discontented,بے قرار ـ ناخوش
discontentednes,بے اطميناني
discontentment,ناخوشي
discontinuance,موقوفي ـ ترک
discontinuation,معطلي
discontinue,بند کرنا ـترک کرنا ـ چھوڑ دينا
discord,بے آهنگي ـ ناچاقي  ـنا اتفاقي
discordance,اختلاف
discordant,ناموزوں ـ مخالف
discount,کٹوتي ـ چھوٹ ـ روکھ€
discountable,قابل تحرير
discountenance,شرمنده کرناـ غيرت دلانا
discounter,سود کھانے والا ـ ساهوکار
discourage,دل شکسته کرنا ـ دل موڑنا ـ حمايت نه کرنا
discouragement,مايوسي
discouraging,مايوس
discouragingly,مايوسي سے
discourse,تقرير کرنا ـ بات چيت کرنا ـگفتگو کرنا
discourser,بات چيت کرنے والا
discourteous,بد خلق ـ بے ادب ـ بد تميز
discourteously,بد تميزي سے
discourtesy,روکھا پن ـ بد اخلاقي
discover,معلوم کرنا ـظاهر کرنا
discoverable,قابل تحقيق
discoverer,معلوم کرنے والا
discovery,انکشاف ـ دريافت
discredit,بے اعتمادي ـ بد نامي
discreditable,رسوائي کے قابل
discreet,هوشيار ـ محتاط
discreeter,محتاط رهنے والا
discrete,تميز کرنا ـ امتياز کرنا
discretion,تميز ـ امتياز
discriminate,الگ کرناـ جدا کرنا ـامتياز کرنا
discrimination,تفريق ـ امتياز
discriminative,امتياز کرنے والا
discriminator,امتياز کرنے والا
discursive,معقول ـ پيچ دار
discus,لوهے کا گردا
discuss,گفتگو کرنا ـبحث کرنا ـکلام کرنا
discussion,مباحثه
disdain,حقير جانناـ حقارت سے ديکھنا
disdainful,ذليل ـ نفرت
disdainfully,نفرت انگيزي سے
disease,مرض ـ بيماري
disembark,جھاز سے  ساحل پر اتڑنا
disembarkation,جھاز سے اتڑنا يا اتارنا
disembarrass,پريشاني سے نکالنا ـ نجات دلانا
disembody,آذاد کرنا ـبرخاست کرنا ـنکال دينا
disembowel,آنتيںنکالنا
disemploy,بے کار کرنا ـ بر خاست کرنا
disempower,بے طاقت کرنا ـ بے اختيا ر کرنا
disengage,چھوڑنا ـ آذاد کرنا ـ الگ کرنا
disengagement,رهائي ـ عليحدگي
disentangle,خلاصي ديناـ چھڑانا
disentanglement,حل ـ خلاصي
disenthrall,نجات دلانا
disentitle,حق چھين لينا
disfavor,ناخوشي ـ ناراض هونا
disfiguration,بد صورتي ـ بد نمائي
disfigure,شکل بگاڑنا ـ بد صورت کرنا
disfigurer,بگاڑنے والا
disfranchise,حقوق شهر يت سے چھين لينا ـ حق رائے سے محروم کرنا
disfranchiser,حق رائے دهي سے محروم کرنے والا
disgorge,اگلنا ـاگلوانا
disgrace,شرم کي بات ـ بے عزتي ـ کم قدر کرنا  ـ کم قدر کرنا ـذليل کرنا ـ باعث شرم هونا
disgracer,ذليل کرنے والا ـ قدر کم کرنيوالا
disgruntled,اداس ـ برهم ـ غير مطمئ€
disguise,روپ بدلنا ـ چھمانا
disgust,نفرت دلانا ـمتفر کرنا
dish,تھالي ـ رکابي ـ کھانا نکالنا
disharmony,بئ آهنگي ـ بے سرا پ€
dishearten,مايوسي کرناـ نااميدي
dishevel,بال بکھيرنا ـ بال نوچنا
dishevelled,پريشان بالوں والا
dishonest,امانت ميں خيا نت کرنے والا ـ بے ايما€
dishonestly,بد کاري ـ مکاري سے
dishonesty,بد کاري ـ خيانت ـ بے ايماني
dishonor,بے آبر کرنا ـرسوا کرنا ـانکار کرنا
dishonorable,ذليل ـ بے عزت
dishouse,گھر چھين لينا  ـ بے گھر کرنا
dishup,کھان  دستر خوان پر چننا ـ واقعا ت کو دلکش دلائل ميں بيان کرنا
dishwasher,برتن مانجھنے والا
disillusion,غلط فهمي دور کرنا ـ وهم دو ر کرنا
disillusionment,وهم کا ازاله
disinclination,نفرت ـ بے رعبتي
disincline,رجوع نه کرنا ـدور رهنا ـ بے رخ هونا
disinfect,جراثيم دور کرنا
disinfectant,جراثيم کش دوا
disinfection,جراثيم کا ازاله کرنا
disinformation,غلط اطلاع ـ غلط خبر
disingenuous,زمانه ساز ـ ذليل
disinherit,عاق کرناـ محروم وراثت کرناا
disintegrate,ايک دوسرے سے عليحده کرنا
disintegration,اجزا کا الگ هوجا نا ـ انتشار ـ تجزيه
disinter,قبر سے مرده نکالنا ـ تفتيش سے معلوم کرنا
disinterest,دلچسپي نه لينا ـ توجه هٹانا
disinterested,غير جانبدار ـ بے لوٹ ـ بے غرض
disinterment,کھود کر نکالنا
disjoin,الگ کرنا ـعليحده کرنا
disjoint,سلسله توڑنا ـ جوڑ جوڑ الگ کرنا
disjunct,عليحده کرنا ـالگ کرنا
disjunction,مفارقت ـ عليحدگي
disjunctive,عليحده کرنے والا
dislike,نفرت ـ نا پسنديدگي
disliker,نفرت کرنے والا
dislocate,جگه سے بے جگه کرنا ـهٹانا ـ موچ آنا
dislocation,هڈي اتر جانا ـموچ
dislodge,نکال دينا ـ مکان ميں رهنے نه دينا
dislodgement,اپني جگه سے عليحدگي ـ نکالا جانا
disloyal,غدار ـ باغي ـ بے وفا
disloyalist,باغي ـ غدار ـ سرکش
disloyalty,غداري بغاوت
dismal,بھيانک ـ هولناک ـ افسرده
dismaler,بد قسمت ـ افسرده کرنے والا
dismantle,حفاظت سے محروم کرنا ـننگا کرنا
dismast,مستول گرا دينا
dismay,خوف زده کرنا ـهمت توڑنا ـدبانا
dismember,جوڑ جوڑ الگ کرنا
dismemberment,عضو عضو الگ کرنا
dismiss,رخصت کرنا ـ بر خاست کرناـ ملامت سے عليحده کرنا
dismissal,مقدمه خارج کرنا
dismissible,قابل برطرفي
dismission,مقدمه خارج هونا
dismount,نيچے آنا  ـ نا زل هونا
dismountable,نيچے اتارنے قابل
disobedience,نافرماني
disobedient,نافرمان ـ سر کش
disobey,نافرماني کرناـ سرکشي کرنا
disobeyer,نافرماني کرنے والا
disoblige,ناخوش کرنا ـناراض کرنا
disobliging,بے مروت ـ لحاظ نه رکھنے والا
disobligingly,بے اعتنائي سے ـ رکھائي سے
disorder,بے ترتيب کرنا ـدرهم برهم کرناـ الٹ پلٹ کرنا
disorderliness,بے ضابطي ـ بے ترتيبي
disorderly,بے ترتيب ـ درهم برهم
disorganization,انتشار ـ ابتري ـ بد انتظامي
disorganize,ابتري ميں ڈالنا ـ توڑنا ـبے ترتيب کرنا
disorganizer,توڑنے ولا ـ بے ترتيب کرنے والا
disown,قبول نه کرناـ انکار کرنا ـ نه ماننا
disparage,بد نام کرناـ کم قدر کرنا
disparagement,بدنامي ـ بے قدري
disparity,اختلاف ـ فرق ـ عدم مساوات
dispart,توپ کا ڈھلوان قطر ـ عليحده هونا ـجدا کرنا
dispassionate,ٹھنڈے دل سے  ـ پر سکو€
dispassionately,بے تعصبي سے
dispatch,روانه کرناـ ترسيل روانگي ـ مراسله
dispatchdes,عجلت سے کرنا ـجلد کرنا
dispatcher,بھيجنے والا
dispel,دل سے برے انديشوں کو نکالنا ـخطرات کو دور کرنا
dispensable,چھوڑنے کے لائق
dispensary,دوا خانه
dispensation,قسمت ـ نصيب
dispense,دے دينا ـ تقسيم کرنا ـتيار کرناـ معافي نا مه تيار کرنا
dispenser,انصاف کرنے والا ـ دوا فروش
dispensible,ناقابل اعتنا ـ غير ضروري ـ چھوڑنے کے لائق
dispersal,شکست ـ پر گندگي ـ انتشار
disperse,منتشر کرنا ـپھيلانا ـ بھگا دينا
dispersion,پريشاني ـ انتشار
dispirit,مايوس کرنا ـدل توڑنا
displace,عهدے سے هٹانا ـنکال باهر کرنا ـ موقوف کرنا ـ قائم مقام بنانا
displacement,برطرفي ـ معزولي
display,ظاهر کرنا ـ نمود کرنا ـنمائش کرنا ـ دکھانا
displayable,دکھانے کے قابل
displease,بيزار کرناـ خفا کرنا ـ رنجيده کرنا
displeasing,گھناؤنا ـ نا خوشگي
displeasure,نا خوشي ـ غصه ـ ناراض کرنا
dispnoeic,ضيق النفس کا مريض
disport,دل بهلانا ـخود کي نمائش کرنا ـ کھيلنا
disposable,قابل فروخت ـ قابل ترک
disposal,فيصله ـ ترک ـ سپردگي
dispose,مرتب کرنا ـ آراسته کرنا ـ مائل کرنا
disposer,مرتب کرنے والا ـ سنوارنے والا
disposition,برتاؤ ـ قابو
dispositive,برتاؤ کرنے والا
dispossess,محروم کرنا ـ خارج کرنا ـ دخل کرنا
dispossession,جن يا بھوت سے نجات ـ محرومي
dispossessor,بے دخل کرنے والا
dispossessory,بے دخلي
dispraise,مذمت کرنا ـ بد نام کرنا
disproof,رد کرنے والي دليل ـ ترديدي ثبوت
disproportion,بے هنگم ـ ناموزں ـ بے اندازه
disproportionat,ناموزں ـ غير متنا سب
disprovable,بخت طلب
disprove,غلط ثابت کرنا ـ باطل کرنا
disputable,قابل بخت ـ قابل تکرار
disputant,تکرار کرنے والا
disputation,تکرار ـ جھگڑا ـ بخت
disputatious,بخت کرنے والا ـ حجتي
dispute,مناظره کرناـ تکرار کرنا ـ بحث کرنا
disputer,جھگڑا کرنے والا ـبخت کرنے والا
disqualificatio,بے مقدري ـ نا قابليت
disqualified,نالائق
disqualify,نالائق قرار دينا ـ ناقابل ٹھرانا
disquiet,بے چين کرنا ـ پريشان کرنا ـ بے آرام کرنا
disquisition,تجسس
disregard,لحاظ نه کرنا ـنظر انداز کرنا ـاهميت نه دينا
disrelish,ناپسند ـ کراهت ـ نفرت ـ کراهت کرنا
disrepair,بوسيدگي
disreputable,بے آبرو ـ نامعقول ـ بد نام
disrepute,بد نامي ـ رسوائي ـ بے قدري
disrespect,بے قدري ـ گستاخي
disrespectable,بے عزتي کے قابل
disrespectful,بے ادب گستاخي
disrespectfully,بے ادبي سے ـ گستاخي سے
disrobe,عرياں کرنا ـبرهنه کرنا
disrober,برهنه کرنے والا
disrupt,منتشر ـ شق کرنا
disrupter,منتشر کرنے والا
disruption,انتشار
disruptive,انتشار پيدا کرنے والا
dissatisfaction,بے اطميناني ـ نا راضگي
dissatisfied,غير مطمئ€
dissatisfy,ناراض کرنا ـبيزار کرنا
dissect,چھيرنا پھاڑنا ـ چاک کرنا€
dissection,چير پھاڑ
dissector,چير پھاڑ کرنے والا
dissemble,بھيس بدلنا ـ پوشيده کرنا ـمکر کرنا
dissembler,ريا کار
dissembling,ريا کاري
disseminate,بکھيرنا ـ اشاعت کرنا ـمشتهر کرناـ شهرت دينا ـتخم داري کرنا
dissemination,تخم ريزي ـ پرچار
dissent,ايک رائے نه هونا ـ اختالاف ـ اعتراض کرنا
dissenter,اختلاف رائے کرنے والا
dissentient,غير متفق
dissention,اختلاف رائے کي بنا پر تکرار يا جھگڑا هونا
dissert,مضمون لکھنا
dissertation,مقاله  ـتحرير  ـ مضمو€
disserve,بد سلوکي کرناـ ضرر پهنچانا
disservice,ضرر رسائي ـ بد سلوکي
dissever,بد سلوکي کرنے والا ـ ضرر پهنچانے والا
dissidence,مخالف ـ ناموافقت
dissident,مخالف رائے رکھنے والا
dissimilar,غير مشابه ـ جدا
dissimilarity,فرق ـ اختلاف
dissimilate,فرق کرنا ـاختلاف کرنا
dissimilitude,اختلاف ـ فرق
dissimulate,منافقت کرنا ـريا کاري کرنا
dissimulation,مکاري ـرياکاري
dissimulator,مکار
dissipate,برباد کرنا ـ دولت اڑانا
dissipater,برباد کرنے والا  ـغائب کرنے والاـ دولت اڑانے والا
dissipation,برباد ـ غائب
dissipative,اڑانے والا ـ ضائع کرنے والا
dissipator,برباد کرنے والا ـ منتشر کرنے والا
dissociate,ميل جول نه کر  رکھنا ـ جدا کرنا
dissociation,جدائي ـ بے تعلقي
dissociative,اتفاق نه کرنے والا
dissoluble,تحليل پذير ـ حل هونے کے قابل
dissolute,بد معاش ـ بد چلن ـ بدکار
dissoluteness,بد چلني
dissolution,شکست معاهد ه ـ موت ـ تحليل
dissolutive,تفريق کرنے والا
dissolvable,قابل تحليل
dissolve,گلانا ـ کمزور کرنا ـ منسوخ کرنا
dissolvent,گداز کرنے والي ـ وه چيز جو کسي دوسري چيز کو پھگلا دے
dissonant,ان مل ـ بے سرا ـ بے جوڑ
dissuadable,باز رکھنے کے قابل
dissuade,کسي کام سے باز رکھنا ـمنع کرنا
dissuader,باز رکھنے والا
dissuasion,روکنا ـ باز رکھنا
dissuasive,باز رکھنے والا
distaff,تکلا ـ چرخه کا ايک حصه
distance,فاصله ـ دو مقام ـ عرصه
distant,سرد مهر ـ فاصله پر
distaste,نفرت ـ کراهت
distasteful,ناگوار ـ ناپسند
distastefully,ناگواري سے
distemper,بيمار کرنا ـ پلاستر پر رنگ کرنے کا مساله يا طريقه
distend,بھول جانا ـ هوا بھر کر پھيلانا
distensible,پھول جانے کے قابل
distension,پھيلاؤ
distill,مقطر کرناـ جوهر نکلنا
distillable,قابل مقطر
distillate,شراب کشيد کرنا
distillation,شراب کي کشيد ـ عرق کشي
distiller,شراب کشيد کرنے والا
distillery,شراب کشيد کرنے کا کار خانه
distinct,ظاهر ـ واضع ـ صاف
distincter,ظاهر کرنے والا
distinction,امتياز ـ تميز ـ فرق
distinctive,امتيازي ـ مختص
distinguish,تقسيم کرنا ـ تميز کرنا ـشناخت کرنا
distinguishable,قابل شناخت
distort,حليه بگاڑنا ـ مسخ کرنا ـ غلط بياني کرنا
distortable,بگاڑنے کے قابل
distorter,بگاڑنے والا ـ مسخ کرنے والا
distorting,بگاڑ
distortion,بگاڑ ـ توڑ موڑ
distortionist,نٹ بازي کرنے والا ـ اپنے اعضا کو توڑ مروڑ کر دکھانے والا
distract,توجه پھيرنا ـ آپے سے باهر هونا
distractingly,ديوانگي سے
distraction,اضطراب ـ پريشاني
distractive,پريشان کرنے والا
distrain,قرقي دلانا ـقرق کرنا
distraint,گھر کے سامان کي ضبطي ـ قرقي
distrait,سنکي ـ خيال ميں گم
distress,تکليف دينا ـ پريشاني ميں مبتلا کرنا
distressful,پر درد ـ تکليف ده
distributable,قابل تقسيم
distribute,تقسيم کرنا ـ بانٹنا
distributer,مهيا کرنے والا ـ تقسيم کرنے والا
distribution,درجه بندي ـ پھيلاؤ ـ تقسيم
distributive,تقسيم کے لائق ـ حرف تقسيم
distributor,تقسيم کرنے والا
district,ضلع ـ حلقه ـ خطه
distrust,بھروسه نه کرنا ـ نه کرناـ بد گماني کرنا
disturb,پريشان کرنا ـخلل ڈالنا ـالجھن ميں ڈالنا
disturbance,خلل ـ فساد ـ مزاحمت
disturber,خلل ڈالنے والا
disunion,جدائي ـ پھوٹ ـ ناچاقي
disunite,الگ کرنا ـ نفاق ڈالنا
disuniter,نفاق ڈالنے والا ـ الگ کرنے والا
disuse,بے استعمالي ـ چھوڑديناـ ترک کرنا
ditch,خندق ـ ناله ـ بد رو کرنا
ditcher,خندق کھودنے والا
ditheism,خير و شر کو دو مستقل قوتيںماننا ـ خير و شر کي کشمکش
ditto,علي هذالقياس ـ ايضا
dittography,کتاب يا نقل نويس کا کسي لفظ يا جمله کا دوباره لکھ جانا
ditty,گيت ـ راگي
diurnal,روز کرنا ـروزانه
divaricate,سڑک يا شاخ کا دو لخت  هونا
divarication,انشقاق ـ جدائي
dive,غوطه ـ ڈبکي مارنا ـپاني ميں جانا
diver,ڈبکي مارنے والا
diverge,منتشر هونا ـپھولنا
divergence,انتشار
divergency,اختلاف
divergent,پھٹ جانے والا
diverse,گونا گوں ـ قسم قسم کا
diversification,اختلاف ـ گونا گوئي
diversified,تبديل کيا هوا
diversify,تبديل کرنا
diversion,انحراف ـ موڑ
diversity,نيا نيا رنگ ـ فرق
divert,هٹا دينا ـ موڑنا
diverter,هٹا دينے والا ـ منحر ف کرنے والا
diverting,مسرور ک€
divest,بے پرده هونا ـ برهنه هونا
divestitive,برهنه کرنے والا
divestiture,برهنگي
divestment,عرياني
dividable,قابل تقسيم
divide,تقسيم کرناـ ٹکڑے کرنا ـجدا کرنا
dividend,حصه ـ بخره ـ کمپني کا منافع
divider,تقسيم کرنے والا
divination,علم غيب ـ پيش گوئي
divine,رباني ـ خدا داد ـپاک
divinise,معبود قرار دينا
divinity,الهوپيت ـ ربوحيت ـ معبود ـديوتا ـ تصوف
divinize,معبود قرار دينا
divisible,قابل تقسيم
division,انقسام ـ حصه
divisor,مقسوم عليه ـ قاسم
divorce,طلاق دے کر عليحده کرناـ طلاق دينا
divorceable,قابل طلاق
divorcee,مطلقه
divorcement,فسخ نکاح ـ طلاق
divorcer,طلاق دينے والا
divulge,فاش کرنا ـ مشهور کرنا
divulgement,مشهور ـ ظاهر
divulger,عياں کرنے والا
dixy,ديگچه ـ ديگ ـ بڑا برت€
dizen,آرائش کرنا ـآراسته کرنا ـسجانا
dizziness,چکر ـ پريشاني
dizzy,چکر دينے والا ـ پريشا€
do,انجام دينا ـ بجا لانا ـ تعميل کرنا ـعمل ميں لانا
doable,کرنے کے قابل
dobbin,چھکڑا يا هل چلانے والا گھوڑا
docetist,اس عقيده کا ماننے والا که حضرت عيسي عليه السلام کا جسم انساني نهيں بلکه نوري تھا
docile,تعليم پذير ـ اصلاح پذير ـ تربيت پذير
docility,اصلاح پذيري
dock,لنڈورا کرناـ دم کاٹنا ـ بال کاٹنا
dockbrief,حکومت کي طرف سے مقرر کيا هواـ مفلس ملزم کا مقدمه
docket,مقدمه کا خلاصه
docktailed,دم کٹا کتا ـ دم بريده
docoity,قزاقي ـ ڈکيتي
doctor,طبيب ـ عالم ـ فاضل ـ مريض کا علاج کرنے والا ـڈاکٹر کي ڈگري
doctrinaire,اصولي ـ اصول پرست
doctrine,تعليم تربيت ـ درس و تدريس
document,دستاويز ـ هدايت دهنا
documentable,قابل هدايت
documentary,تحريري شهادت ـ تحريري ثبوت
documentation,تحريري شهادت کي فراهمي
dodder,ايک بيل ـ سراهنا ـ کمزور هونا
dodderer,ڈگمگانے والا
dodge,دغا کرناـ روپوش هونا ـفريب کرنا
dodger,جھانسه دينے والا
dodgy,بچنے والا
dodo,عنقا ـ سميزع
doer,کام کرنے والا ـ کرنے والا
does,کرناـ کام کرنا ـحکم ماننا
doff,ترک کرنا
doffer,ترک کرنے والا
dog,کتا
dogcheap,کوڑيوں کے مول ـ بھت سستا
dogdays,جولائي اگست کي گرمي کا مهينه
dogged,سگ طبع ـ ضدي ـ دھن کا پکا
doggedly,مضبوطي سے
doggedness,ضد ـ هٹ دھرمي ـ بد مزاجي
doggish,سينه زوري سے ـ سگ آسا
doggrel,زنل قافيه ـ تک بندي
dogma,قاعده ـ اصول ـ قول
dogmatic,خود رائے ـ پر تکبر
dogmatist,اپنے خيال کو مستند سمجھنے والا ـ بدعتي
dogmatize,هٹ دھرمي کے ساتھ بے دليل بات کهنا ـکسي عقيده مسلمه کے طور پر بيان کرنا
doldrums,خاموشي ـ اداسي
dole,نصيب ـ قسمت ـ حصه
doleful,بے چين ـ اداس
doll,خوبصورت بے وقوف عورت ـ گڑيا
dollar,امريکه کا سکه
dolly,گڑيا کا پيارا نام
dolorous,مصيبت زده ـ اداس ـ درد ناک
dolphin,ايک قسم کي مچھلي
dolt,کوڑھ مغز ـ احمق
domain,حلقه اثر ـ خيال و عمل کا ميدا€
dome,شاندار مکان ـ عمارت ـ گنبد
domestic,داخلي ـ اندروني ـ گھريلو
domesticate,گھر ميں بھيٹنا ـ پالتو بنانا ـمهذب کرنا
domestication,مانوس کرنا ـ مهذب  بنانا
domesticator,مهذب بنانے والا
domesticity,گھريلو سيرت ـ سادگي
domicile,رهنے کي جگه
domicillary,معائنه مکان کے بارے ميں ـ مکان کے متعلق
dominance,اقتدار ـ تسلط ـ اثر
dominant,حکمران ـغالب ـ زبر دست
dominate,ڈي اثر کرناـ غالب هونا ـ پيش پيش رهنا
domination,حکومت ـ فرمانبرداري
dominator,اقتدار کرنے والا
domineer,ظلم سے حکومت کرنا ـزبردستي کرنا
dominical,حضرت عيسي کا ـ مسيحي ـ انوار کا
dominion,راج ـ حکومت
domino,عورتوں کا مقامي لباس
don''t,نهيںکرنا
don,هسپانوي شخص ـ کپڑے پهننا
dona,عورت ـ معشوق
donate,چنده دهنا ـعطا کرنا
donation,امداد ـ عطيه ـ هديه
donative,چنده دينے والا
donator,چنده دينے والا
donee,امداد ها عطيه پانے والا ـ وه جسے عطيه ملے
