donkey,گدھا ـ بدتميز
donor,چنده دينے والا
donothing,نااهل ـ ناکاره ـ نکما
doom,نصيب ـ قسمت
door,دروازه ـ در
dope,خواب آور ها نشه والي دوا کھلانا
doper,نشه والي دوا کھلانے والا
doric,دهقاني زبا€
dormancy,حرکت نه کرنا ـمعطل کرنا ـ بے حسي
dormant,بے حس و حرکت
dormitory,خوب گا ه ـ سونے کا کمره
dormouse,گلهري کي قسم کا ايک جانور
dorthybag,عورتوں کا پينڈ بيگ جو کلائي پر لٹکا ليا جاتا هے
dose,دوا کي خوراک  ـدوا پلانا
doser,دوا پلانے والا
dot,صفر ـ نقطه
dotage,انتشار ـ حواس
dotard,ضعيف ـ سترا بهترا
dotardly,ضعيفي
dote,کم عقل هوناـ جا ن دينا ـ دماغ ميں خلل آجانا
doter,منتشر کرنے والا
doth,کرنا ـکام کرنا
dott,ايک پرند جو آساني سے پکڑ ليا جاتا هے
dotty,نقطے دار ـ نقطوں سے نشان لگانا
double,دو ـ گنا ـدهرانا ـ دو چند کرنا
doubler,دو چند کرنے والا
doublet,جفت ـ جوڑا ـ مردانه صدري
doubt,تامل ـ شک ـ شبه ـگمان کرنا
doubtable,شک کے قابل
doubter,شک کرنے والا
doubtful,مشتبه ـ غير واضع ـ مشکوک ـ مبهم
doubtless,تسليم کرتے هوئے
douche,صاف هوناـ پاني کي پچکاري
dough,خمير ـ ميدا
doughty,شير ـ عالي نصب ـ رعب دار
dour,ضدي ـ کڑا ـ تند خو
dourer,ضد کرنے والا
dourness,ضد ـ سختي
dove,قمري  ـ فاخته
dover,خوش خبري دينے والا
dovetail,نرمادگي ـ جوڑ بٹانا
dowager,رياست دار بيوه
dowdy,بيڈول ـ پھوهڑ ـ بد لباس عورت
dower,استري دھن ـ جهيز ـ کنيا دا€
down,روتين دار چيزـ اداس ـ گرد ش تقرير
downcast,مايوس ـ افسرده دل
downfall,بربادي ـ تباهي
downhill,ڈھال ـ اتار
downpour,بڑي زور کي بارش
downright,صاف ـ ظاهر ـ کھلا ـ واضع
downtrod,روندناـ ٹھکرنا
downtrodden,روند ا هوا ـ ٹھکرايا هوا
downward,نيچے کي طرف
downy,نرم ـ گدگداـ پهاڑوں کے ٹيلوں جيسا
dowry,جهيز ـخدا داد قا بليت
dowsing,طلسمي چھڑي کے ذريعے زير زمين پاني يا معدنيات کا حال معلوم کرنا
doxy,فقير کي دايته ـ معشوق ـ رنڈي
doyen,سفير اعلٰي
doze,اونگھناـ آنکھ لگنا
dozen,درج€
drab,بادامي ـ هلکا بھورا ـ بد کاري کرناـ فاحشه
drabber,بد کاري کرنے والا
drabble,لتھڑناـ آلوده کرناـ چھپ چھپ کرنا
drachm,درهم ـ درم
dracunculus,عقر قرحا
draff,تلچھٹ ـ بھوسي ـ پھوک
draft,مسوده کرناـ خاکه تيار کرنا
draftable,خاکه تيا ر کرنے کے قابل
drafter,خاکه تيار کرنے والا
draftsman,نقشه نويس
drag,کھينچنا ـهولے هولے چلنا ـ سروان ـ کانٹا
dragger,کھينچنے والا ـ هولے هولے چلنے والا
draggle,آهسته چلنا ـپيچھے ره جانا
dragoman,مترجم
dragomen,مترجم جمع
dragon,خزانے کا سانپ ـ پردار سانپ ـ ا‘دھا
dragoon,سپاهي ـ سوار
drain,نالي بناناـ چڑھا جاناـ طاقت زائل کرنا
drainage,پاني کي نکاسي کا انتظام
drainer,نکاسي کا انتظام کرنے والا
drake,ايک کيڑا ـ قاز ـهنس ـمرغابي
dram,شراب کا ذرا سا گھونٹ
drama,ناٹک ـ ڈراما
dramatic,تمثيلي ـ ناٹنکي ـ موثر
dramatis,ڈرامے کے کردار
dramatist,تمثيل نگار
dramatize,ناٹک تيار کرنا
dramaturge,ڈراما نويس
dramaturgy,فن تمثيل ـ ڈراما نويس کے اصول
drapable,آراسته کرنے کے قابل
drape,کپڑے سے آراسته کرناـ پردے لٹکانا
draper,کپڑا بيچنے والا ـ پارچه فروش
draperied,تهه نه تهه کرناـ پردوں سے آراسته کرنا
drapery,کپڑے کي دکا€
drastic,مخت ـ مضبوط ـ قوي
draught,چھکڑا ـ مچھليوںکا جال ـ دوا کي خوراک
draughtsman,نقشه نويس ـخاکے تيار کرنے والا
draughty,هوادار
draw,کھينچ کر لے جانا ـ خاکه بنانا
drawable,کھينچنے کے قابل ـ خاکه بنانے کے قابل
drawback,کھوٹ ـ قصور ـ عيب
drawbridge,وه کلدار پل جو ضرورت کے وقت اٹھايا جا سکے
drawcansir,وه شخص جو دوست اور دشمن دونوں کيلئے خطرناک هو ـ بد معاش
drawee,هنڈي کا روپيه لينے والا ـجس کے نام سے هنڈي هو
drawer,هنڈي کرنے والا ـ ميز کي دراز ـ تنگ
drawing,خطوط اندازي ـ خطوط کشي
drawl,چبا چبا کر باتيں کرناـ هکلانا
drawler,چبا چبا کر باتيں کرنے والا
drawn,کھيل ميں فريقين کا برابر هونا
drawwell,گهرا کنواں جس ميں چرخي لگي هو
dray,ٹھيلا ـ گاڑي
dread,دهشت ـ خوف ـ انديشه ـ خطره
dreadful,تليف ده ـ ڈروناـ خوفناک
dreadnought,موٹا کپڑا يا اسکا کوٹ ـ زبردست جنگي جھاز
dream,خواب ـ خيال ميں هونا ـ خيالي پلاؤ پکانا
dreamer,خيالي پلاؤ پکانے والا
dreamland,خيالي پلاؤ
dreamreader,خواب کي تعبير
dreamy,قوت عمل سے محروم
drear,اداس ـ سنسان  ـافسرده
dreary,اداسـ سنسا€
dredge,سيپوں کا جال ـ کيچڑ نکالنا ـآٹا يا سفوف وغيره چھڑکنا
dredger,کيچڑ نکالنے والا
dreg,بے کار شے ـ درد ـ فضله ـ نکمي چيز
drench,جلاب ـ موسلا دھار بارش
drencher,کثرت سے پلانے والا
dress,صف بندي کرناـ صفوںکو درست کرنا ـ پولاک ـ لباس
dressdown,خبر لينا ـ ڈانٹنا ـ مارنا
dresser,برتنوںکي الماري
dressing,پولاک ـ لباس ـ زخم کي مرهم پٹي
dressmaker,پولاک  بنانے والا
dressout,بھڑکيلا لباس پهننا ـ زرق برق کپڑے پهننا
dressy,خوش پوش
dribble,قطره قطره ٹپکناـ رسناـ ادھر ادھر کرنا
dribblet,چھوٹا سا قطره ـ ذرا سا
drift,ريگ رواں ـ پاني کا بھاؤ ـ بهالے جاناـ اڑالے جانا
drifter,اڑا کر لے جانے والا
drill,سوراخ کرنے والا آله ـ برماـ پودوں کي قطار ـ سوراخ کرنا
driller,سوراخ کرنے والا
drillmaster,ڈرل چلانے والا
drink,پي کر خالي کرنا ـپينا ـنوش کرناـ شراب
drinkable,پينے کے قابل
drinker,پينے والا
drip,قطره ٹپکنا ـرسنا ـ چونا
dripping,چربي جو گوشت کو گرم کرکے نکالي جائے ـ چربي ـ گھي
drippy,ٹپکنے والي
drivable,چلانے کے قابل
drive,چلانا ـ دھکا دينا ـمجبور کرنا
drivel,بچوںکي رال ٹپکناـ بکواس کرنا
driver,چلانے والا
drizzle,بوندا باندي هونا ـتريح هونا
droll,عجيب ـ انوکھا
droller,مذاق کرنے والا
drollery,انوکھي دل لگي
dromedary,اونٹني ـ ناقه
drone,نکھٹو ـکاهل ـ شهد کي نر مکھي
droop,غروب هونا ـ ڈوبنا ـ مر جھانا ـافسرده هونا
drop,بوند ـ قطره ـ چونا ـ ٹپکنا
droppings,جو چيز جو ٹپک کر گرے ـ ليد ـ لينڈي
dropsy,اسنسقا ـ چلندر ـ حد سے زائد نفع
dross,کوڑا کرکٹ ـ زنگ ـ فضله ـ کھوٹ
drought,قحط سالي ـ خشک سالي
drove,چلانا ـهانکنا
drover,گلے کو نخاس ميں لے جانے والا ـ مويشي کا بيوپاري
droving,مويشي کا بيوپاري
drown,ڈوبنا ـ غرق کرنا ـ غرق هونا ـغالب آجانا
drowse,نيند آنا ـآنکھ لگ جانا ـاونگھنا
drowsiness,کاهلي ـ سستي ـ اونگھ
drowsy,اونگھتا هوا ـ خواب آلوده
drub,ڈنڈے مارناـ مارنا پيٹنا
drubber,مرپيٹ کرنے والا
drubbing,مر پيٹ
drudge,خدمت کرنے والا ـ غلام کي طرح کام کرنے والا
drudgery,مشقت ـ محنت
drug,جڑي بو ٹي ـ مفرد دوا
druggist,دوا ساز
drugmaker,دوا ساز
drugstore,دوائيوں کي دکا€
druid,پيش گوئي کرنے والا ـ کاپ€
drum,نفار پر چوٹ لگاناـ ڈھول بجانا
drummer,طبل نواز
drunk,شرابي ـ سر مست ـ مخمور
drunkard,مے خوار ـ شرابي
drunkenness,شراب خوري
drunker,شراب پينے والا
dry,خسک کرنا ـتري دور کرنا
dryable,خشک کرنے کے قابل
dryer,خشک کرنے والا
dryish,بے مروت سا ـ قدرے خشک
dryness,خشکي
dual,دو حصوں ميں تقسيم کرنا ـدگنا
dualism,دروازلي ـ قوتوں کا قاتل هونا
duality,دونا
dub,کسي چيز کا ريکارڈ تيار کرنا ـ کوئي نيا لقب دينا
dubber,ريکارڈ بنانے والا
dubbing,نام يا لقب نانٹ بنانے کا عمل ـ جوتے کا روغ€
dubiety,شک ـ مشکوک معامله
dubious,غير متعبر ـ مشکوک ـ مشتبه
dubiousness,مشکوک هونا ـشبه
dubitable,مشکوک ـ غير يقيني
dubitation,مس و پيش ـتذبذب
dubitative,پس و پيش کرنے والا ـ مذبذب
ducal,ڈيوک کي طرح
ducat,ايک طلائي سکه
duchess,آن بان کي عورت
duchy,ڈيوک کي رياست
ducility,تشکيل ـ نرمي ـ ملانمت
duck,بظخ ـ مرغابي ـ پھرتي سے جھک جانا ـ غوطه لگانا
ducker,بطخيں پالنے والا ـ خوشامدي ـ غوطه خور پرنده
duct,نالي ـ تنگ راسته
ductile,ملائم ـ نرم
dud,بے نتيجه تجويز ـ بے کار آدمي
dude,نفاست پسند ـ ٹھاٹھ کرنے والا
dudgeon,نااتفاقي ـ ناراضگي ـ ان ب€
dudish,بانکا چھيلا سا ـقدرے نفاست پسند
dudtileness,تربيت پذيردي ـ لچک
due,واجب الادا ـ لائق ـ مناسب ـ اختيار ـ حق
duel,دو آدميوں کي لڑائي ـ کشتي لڑنا
dueler,کشتي لڑنے والا
duelist,ڈوبل لڑنا
duenna,استاني ـ نگراںعورت
duet,آوازي گيت ـ مکالمه
duff,شکل بدلنا ـپرانے مال نيا کر کے بيچنا
duffer,خراب مال کو داموں ميں بيچنے والا ـ شکل بدلنے والا
dug,کھودنا ـ خالي کرنا
dugout,ڈونگي ـ کشتي
duke,جاگيردار ـنواب
dukedom,نوابي رياست
dulcet,مزيدار ـ لذيد
dulcify,ميٹھي بنانا ـشيريني پيدا کرنا
dulcimer,بربط ـ ستار کي قسم کا باجا ـتاروں کا باجا
dull,ساده لوح ـ غيبي ـ احمق
dullard,بے وقوف ـ کند ذه€
dullish,بيوقوف سا
dullness,حماقت ـ سستي
dully,حسب ضابطه
dulness,حماقت ـ سستي ـ کند ذهني
duly,کما حقه ـ حسب ضابطه
dumb,گم سم ـ گنگ ـ گونگا ـخاموش
dumbfound,لاجواب کر دينا ـ گھيرا دينا ـ گونگا کرنا
dumdum,ايک قسم کي بندوق کي گولي جو جسم ميں داخل و کر پھيلتي اور پھٹي هے ـ ڈم ڈم
dummy,گونگا مجسمه جس کو دوکا ن ميں نمائش کيلئے کپڑے پهنا کر کھڑا کرتے هيں ـ کٹھ پتلي ـ احمق ـ مصنوعي چيز ـ فر ضي
dump,موٹي چيز ـ پست قد ـ مضبوط آدمي
dumpling,حلوه ـ کھير
dumps,بروگي گيت ـ اداسي ـ رنج ـ غم
dumpy,چھوٹا اور موٹا
dun,سخت گير ـ هلکے کالے رنگ کا
dunce,بے وقوف ـ الو
dunderhead,احمق ـ کاٹھ کا الو
dung,گندگي ـ غلاظت ـ اخلاقي گندگي
dungeon,کمين گاه ـ پناه کي جگه
dunghill,گھوڑا ـ کوڑا ـ بزدل آدمي ـ گنده مکا€
dungy,غليظ ـ ميلا
dunner,سخت گير ـ متقاضي
duny,بهرا ـ بيوقوف ـ کند ـ ذه€
duo,دو آدميوں کے گانے کا گيت
dupable,دھوکا کھائے جانے والا
dupe,ساده لوح ـ دھوکا دينا
duper,دھوکا دينے والا
duple,دھرا
duplex,دھرا
duplicate,دھرا کرنا ـدگنا کرنا ـنقليںکرنا
duplication,نقل ـ هم نوع
duplicator,نقليں اتارنے کي مشي€
duplicity,مکاري ـ دو رخا پن ـ جعلي نقليں تيار کرنا
durability,استحکام ـديرپائي
durable,استوار ـ دائمي ـ مظبوط
durableness,استحکام
durance,قيام ـ قيدـ استقلال
duration,مدت ـ عرصه ـ معيا د ـ مهلت
duress,ناجائز ـ تشدد ـقيدل
durian,درياں ـ لذيذ ميوه ـ پريوں کا ميوه
during,اندر ـ درمياں ـ اس عرصه ميں
durra,جوارا ـ باجرا
dusk,تاريکـ شام کا دھندلکا
dusky,دھندلا
dust,مٹي ـ خاک ـ صاف کرنا
dustbin,ردي کي ٹوکري
duster,جھاڑن ـ ميز کرسياں صاف کرنے والا
dusting,گرد يا سفوف چھڑکنا
dusty,بے مزه ـ خاک آلودها
dutch,ولنديذي باشنده
dutchman,نيدر لينڈ کا باشنده
duteous,فرمانبردار ـ فرض شناس
duteousness,فرض شناسي ـ اطاعت شعاري
dutiable,قابل محصول
dutiful,وفادار
duty,فرٰض ـ حق ـ اخلاقي پابندي
dwarf,بونا ـ ناٹاـ پسته قد ـ ٹھگنا
dwarfish,پسته قد
dwell,بسنا ـ رھناـ سکونت اختيار کرنا
dweller,ساکن ـ مقيم ـ باشنده ـ رھنے والا
dwelling,قيام ـ مسکن ـ مکا€
dwindle,کم هوناـ سکڑناـ قدر گھٹنا
dyable,رنگ دينے کے قابل
dye,رنگ دينا
dyeable,رنگ دينے کے قابل
dyeing,آخري وقت کا
dyer,رنگ دينے والا
dying,موت ـ مرنا
dyke,روک ـ بند
dynamic,قوت عمل رکھنے والا ـحرکي قوت رکھنے والا
dynamism,به نظريه که ذهن اور ماده فطري قوتوں کي حرکت سے پيدا هوتے هيں
dynamite,بھک سے اڑانے والا
dynamiter,برقي قوت ناپنے کا آله
dynamo,برقي قوت پيدا کرنے والي مشي€
dynamometer,برقي قوت ناپنے کا آله
dynasty,شاهي گھرانه
dysenteric,پيچش کے متعلق
dysentery,پيچس
dyspepsia,بد هضمي ـ ضعف ماده
dyspeptic,معده کا مريض
dyspnoea,سانس کا رکنا
