gunfight,بندوقوں کي لڑائي
gunfighter,بندوقوں سے لڑنے والا
gunfire,گن فائر
gunman,محافظ
gunned,بندوق والا
gunner,بندوق سے مارنے والا
gunnery,توپ بنانے کا فن ـ آتش بازي
gunny,بورا ـبوري
gunshy,بندوق کي آواز سے ڈرنے والا
gup,بے بنيا د افواه ـگپ
gurgle,غرغر کي آواز نکالنا ـ غرغرانا
gurnard,بڑے سي کي ايک سمندر مچھلي
gush,پھوٹ نکلنا ـ زور سے اچھلنا
gusher,مستعدي سے کام کرنے والا ـ اچھلنے والا
gushy,پرجوش
gusset,نکتا کپڑا جو لباس کو مضبوط بنانے کيلئے لگائيں ـ سنگھاڑا ـ چڑيا
gust,زور کا هوا کا جھونکا ـ مزا ـ ذائقه
gustable,لذت کے قابل ـ مزا کے قابل
gusto,مذاق ـ ذائقه ـ شوق ـ جوش
gusty,پرجوش ـ زور کا
gut,آنتيں ـ اوجھڑي ـ دم ـ حوصله ـ صاف کرنا ـنگلنا
gutter,ناله ـ موري ـ پرناله
guttural,گلے سے نکلنے والي ـ حلق کي ـ حلق سے ادا کيا هوا
guy,جھاز کا سامان ـ گائي فاکس کا پتلا جو نومبر ميں جلايا جاتا هے ـ رفوچکر هونا ـمذاق اڑانا ـ فراري
guzzle,بے طرح کھانا  اور شراب پ
guzzler,مسرفـ خراچ ـ فضول خرچ
gymkhana,مختلف کھيلوں کي جگه
gymnasium,ورزش گاه
gymnast,ورزش کا استاد
gymnastic,ورزش کا طريقه ـ جسماني موڑ توڑ
gymnic,کستر کے متعلق
gymnical,کسرت کے متعلق
gymnosophist,مني ـ بھگت ـ برهنه درويش
gynaecocracy,عورتوں کي حکومت
gypsum,جسپم ـ کھريا مٹي
gypsy,خانه بدوش ـ شرير عورت
gyrate,چکردار
gyration,گردش ـ چکرا
gyratory,گردش کرنے والا ـ چکر دينے والا
gyre,گھومنا ـ گردش کرنا ـ چکر دينا
gyro,چکر ـ دور
gyve,بيڑي ـ هتھکري
