g,انگريزي حروف تهجي کا ساتواں حرف
gab,بک ـ بک ـ بکواس ـ گپ شپ ـ بکواس کرنا
gabble,بکنا ـ بک بک کرنا ـ جلد جلد بولنا
gabbler,بک بک کرنے والا ـ جلد بولنے والا ـ بکواس کرنے والا
gaberdine,چوغه ـ لباده
gabion,ڈليا ـ ٹوکرا ـ چھابا
gable,ديوار کا تکنا
gablet,چھوٹا چھجا ـ چھوٹا سا نوک دار حصه
gaby,احمق ـ بيوقوف
gad,اظهار حيرت کے لئے ـ يا الله
gadabout,آواره گردي کرنا
gadfly,ڈانس ـ بڑي مکھي ـ چم چچڑ ـ سر هر جانے والا آدمي
gadget,ترکيب ـ تدبير ـ چال
gadgeteer,مشين کا چھوٹا پرزه ـ چال ترکيب
gaelic,اسکاٹ لينڈ کي کيلٹ نسل
gaff,انکڑا ـ مجھلي مارنے کا برچھا
gaffer,بڑے مياں ـ بوڑھا چوهدري
gag,منه بند کرنا ـ زنان بندي کرنا ـ منه ميں کبڑا ٹھونسنا ـ دھوکا دينا
gage,کوئي چيز گرو کرنا ـ ضمانت ـ مکفول کرنا
gager,ضمانت ميں رکھانے والا
gaggle,کٹ کٹ کي آواز نکلنا
gaiety,دل لگي ـ چهل ـ خوش طبعي ـ زرق برق ـ رنگ رلياں
gaily,خوش طبعي سے ـ نماهش سے
gain,حاصل کرنا ـ پانا ـ جيتنا ـ سبقت لے جانا ـ جيتنا ـ کامياب هونا ـ نفع ـ ترقي
gainable,حاصل کرنے کے قابل
gainer,حاصل کرنے والا
gainful,مفيد ـ سود مند
gainless,بے فائده ـ لا حاصل
gainsaid,انکار ـ رد
gainsay,انکار کرنا ـ رد کرنا ـ ترديد کرنا
gainsayer,رد کرنے والا ـ ترديد کرنے والا ـ مخالفت کرنے والا
gainsaying,ترديد ـ مخالفت
gait,رفتارـ چال ـ روشن
gaiter,موزه ـ جواب ـ ساق و پوش
gala,جشن  ـ تقريب ـ عيد ـ تهوار
galaday,خوشي کا دين
galaxy,کهکشاں ـ ستاروں کا جھومٹ ـ ناکي لوگوں کا مجمع ـ حسينوں کا مجمع
galdly,شاداں و فرحاں
gale,تند هوا کا جھونکا ـ نسيم سحري
galen,مذاق کے طور پر طبیب حاہق ۔ جالینوس ۔
galena,کان سے نکالا هوا کچه سيسه
galenic,جڑي نوٹي کي
galilee,کرجا کا برآمده
galingale,خولنجان ـ پان کي جڑ
galipot,ايک قسم کا تاڑھا تارپين
gall,رگڑنا ـ دق کرنا ـ ستانا ـ ناک ميں دم کرنا ـ ذليل کرنا ـ خفيف کرنا
gallant,پر تکليف ـ خوش لباس ـ شاندار ـ پر شوکت ـ شجاع ـ عاشق مزاج
gallantly,مردانه ـ عاشقانه ـ جانبازي
gallantry,جونمردي ـ عالي همتي ـ بهادري ـ بلند همتي
gallery,لمبا کمره ـ لمبا برآمده ـ غلام گردش
galley,پرانے زمانے کا جنگي جهاز ـ چھابے کے حروف کا تخته
gallic,فانسيسي ـ باشندوں گال کے متعلق
galling,سخت ناگوار ـ پريشان کن ـ تکليف ده
gallipot,مٹي يا چيني کے برتن ـ کليا
gallivant,آواره گردي کرنا ـ آواره پھرنا
gallivanter,آواره کردي کرنے والا
gallo,فرانس کا ـ فرانس کے متعلق
gallomania,فرانسيسيسي چيزوں کا خبط
gallomaniac,فرانسيسي چيزوں کا ديوانه
gallon,ايک انگريز ي ناپ
galloon,سوتي ـ ريشمي ـ پٹکه ـ پيٹي
gallop,پوري تيزي سے ـ سرهٹ
galloper,سرهٹ دوڑنے والا
gallophobia,جو فرانس سے خاهف هو
galloway,جھوٹے قد کا گھوڑا ـ ٹانگن
gallows,پھانسي ـ پھانسي کا تخنه ـ ورزش کا تخته
galop,ايک تيز انگريزي ناچ
galore,کثرت سے ـ بهتاب سے ـ فروائي
galosh,جوتوں کے اوپر پهننے کے ربر کے موزے
galvanic,بجلي پيدا کرنے کے متعلق ـ بر وقت ـ بتاوٹي
galvanisediron,لوها جس پر جست کي قلعي هو
galvanism,برقي قوت جو کيميا ئي عمل سے حاصل کي جائے
galvanization,قلعي ـ ملمع سازي
galvanize,کيمائي عمل سے بجلي کي قوت پيدا کرنا
galvanizer,ملمع ساز
gambit,شطرنج کي چال
gamble,قمار بازي ـ جوا کھيلنا
gambler,قمار باز ـ جواري
gamboge,سيام اور کمبوٹيا کے درختوں سے نکالا هوا گوند جو پيلا رنگ کرنے متيں کام آتا هے
gambol,کودنا ـ کھيلنا
game,تفريح ـ سير ـ کھيل ـ برد ـ شکار ـ کام ـ دليد ـ بهادر
gamely,همت سے ـ بهادري سے
gamer,جوا کھيلنے والا
gamesome,چنچل ـ خوش طبع
gamesomely,شوخي سے ـ خوش طبعي سے
gamesomeness,خوش طبعي ـ شوخي
gamester,شکاري
gaminghouse,قمار خانه ـ جوا خانه
gamma,يوناني حروف تهجي کا تيسرا حروف
gammon,سور کي نمک لگي هوئي خشک ران ـ دغا کرنا ـ دھوکا کرنا ـ فريب
gamut,سرگرم
gamy,شکار سے بھرا هوا ـ جري باهمت
gander,بے وقوف ـ ساده لوح
gang,جتھا ـ گروه طاهفه ـ محفوظ ـ مضبوط کرنا
ganger,قليوں کا جمعدار
gangetic,دريائے گنگا کا
ganglion,نس کا ورم ـ محور
gangrene,فساد ـ نسيج ـ سڑا هوا
gangrenous,ناسور دار ـ گلا هوا ـ سڑا هوا
gangway,راه ـ تنگ راسته ـ گزر گاه
ganja,گنجا
gaol,قيد خانه ـ جيل خانه ـ قيد ـ قيد کرنا ـ جيل ميں ڈالنا
gaoler,قيد کرنے والا
gap,خندق ـ کھائي ـ درز
gape,جمائي لينا ـ منه کھولنا ـ هکا بکا ره جانا
gaper,جمائي لينے والا
gapped,شق ـ شگاف دار
gappy,شق ـ شکاف دار
garage,گاڑياں کھڑي کرنے کي عمارت
garb,لباس ـ پوشاک  ـ بھيس
garbage,اوجھڑي ـ آلائش ـ فحله ـ کوڑا کرکٹ ـ فحش کتابيں
garble,تحريف کرنا ـ چن لينا ـ بد دينتي سے افتباس کرنا
garbler,تحريف کرنے والا
garden,پھلواڑي ـ باغ ـ گلشن ـ شاداب ـ خطه
gardened,باغ بنايا هوا ـ چمن والا
gardener,مالي ـ باغبان
gardenia,گل چاندني ـ موگرا
gardening,باغباني ـ باغ لگاناـ مالي کا کام
gargantuan,ديو قامت ـ جسيم
gargle,غراره کرنا
gargler,غراره کرنے والا
gargoyle,ايک اطالوي وطن پرست رهنما
garibaldi,ايک اطالوي وطن پرشت رهنما
garish,بھڑکيلا ـ چمکدار ـ نمائشي
garishness,چمک ـ دکھاوا
garland,هار ـ پھول مالاـ گلدسته ـ گجرا
garlic,لهسن
garlicky,لهسن پڑا هوا
garment,کپڑے ـ لباس ـ پوشاک ـ جوڑا
garner,غلے کا گودام ـ کھته
garnet,ياقوت ـ لعل ـ تامڑا
garnish,سنوانا ـ آراسنه کرنا ـ سنگارنا ـ کھانے کي پليٹيں سجانا
garnishable,آراسته کرنے کے قابل
garnishment,کھانے کي رکابيوں کي سجاوٹ
garniture,حاشيه آرائي ـ زيبائش íـ لباس
garret,اوپر کي منزل کا کمره ـ سر ـ دماغ
garrete,ديوار بناتے وقت چھوٹے چھوٹے پتھر ديوار ميں لگانا يا بھرنا
garrison,قلعه کي فوج
garrote,گلا گھونٹنے کا آله
garroter,گله کھونٹنے والا
garrotte,گلا گھونٹنے کا آله
garrulous,بکواس ـ بک بک کرنے والا
garter,موزه کا بنک يا فيته ـ لچکدار ـ پٹي
gas,گيس
gasbag,شيخي باز
gasconade,شيخي ـ لاف گذاف ـ ٹينگ مارنا
gaseous,گيس والا ـ گيس کي طرح
gash,گهرا زخم ـ کاري زخم
gasification,گيس کي شکل دينا
gasify,گيس کي شکل دينا
gasket,چھوٹي رسي
gasoline,اڑ جانے والا سيال ـ گيسو لين
gasometer,گيس رکھنے کے پيپے
gasp,هانپنا ـ سانس کھيچنا ـ سانس پھول جانا
gasper,سستا سگريٹ
gasser,هوائي باتيں کرنے والا ـ غباره
gassiness,زبائي جمع خرچ
gassy,گيس سے بھرا هوا
gastric,شکمي ـ پيٹ کا
gastro,مرکب الفاظ کا سابقه ـ پيٹ ـ شکم
gastrologist,پيٹ کے امراض کا ماهر
gastrology,پيٹ کے امراض کا علم
gastronome,کھانے کا مبصر
gastronomic,فن طباخي سے متعلق
gastronomical,فن طباخي سے متعلق
gastronomy,فن غذائيت
gate,در ـ دروازه ـ پھاٹک ـ راسته ـ راه ـ لاحقه
gatecrasher,ناخوانده مهمان
gateway,دروازه ـ دروازه يا گزر گاه
gather,اکٹھا کرنا ـ جوڑنا ـ جمع کرناـ فراهم کرنا íـ يکجا کرنا ـ انتخاب کرنا
gatherer,جمع کرنے والا ـ اکٹھا کرنے والا
gathering,جماعت ـ مجلس ـ اجتماع
gauche,اناڑي ـ تاواقف
gauchely,اناڑي پن سے
gaucherie,بيهودگي ـ اناڑي پن
gaud,نمائش لباس ـ ٹيپ ٹاپ
gaudily,نمائش انداز ميں ـ بھڑکيلے پن کے ساتھ
gaudiness,نمائش انداز
gaudy,پر تکلف ـ دھوم دھام کا جلسه
gaudyday,دعوت کا دن ـ جشن کا دن
gauffer,چنت ٹالنا ـ تھه کرنا ـ موڑنا
gauge,ناپنے کا آله ـ باران پيما ـ ناپ
gaugeable,ناپنے کے قابل ـ انداز کے قابل
gauger,ناپنے والا ـ انداز کرنے والا
gauls,گال کا باشنده
gaunt,دبلا پتلا ـ سوکھا
gauntlet,پنجه ـ دستانه ـ فوجي سزا
gauze,گاج ـ باريک ريشمي کپڑا
gauzy,پاريک ريشمي کپڑے کا
gave,ديا هوا
gawk,هولا ـ بے تکا آدمي
gawkiness,بے ٹھنگا ـ بے تکا پن
gawky,هولا ـ بے تکا
gay,مسرور ـ خوش ـ مگن ـ هنس  مکھ ـ بے فکر
gayer,خوش کرنے والا
gaze,شوق سے ديکھنا ـ گھور کر ديکھنا
gazelle,پرن ـ آپو ـ غزال
gazer,شوق سے ديکھنے والا
gazette,جريده اعلاميه ـ گزٹ ـ اخبار شائع هونا
gazetteer,فرهنگ جعرافيه
gazogene,سوڈا وائر بنانے کي مشين
gear,گاڑي کے پرزے ـ سازو سامان ـ کل پرزے ـ دندائے دار چکر
gearbox,گاڑی کا پرزہ ۔
geegeegee,گھوڑا
geese,قاز کي  جمع قازين
gehenna,دوزخ ـ نرک ـ جهنم
geisha,جاپاني رقاصه
gelatin,ايک چيپ دار ماده
gelatine,ايک چيپ دار ماده
gelatinous,ليس دار
gelded,خصي  ـ آخته
gelder,آخته کرنے والا
gelding,خصي گھوڑا
gelid,نهايت سرد ـ انتها ٹھنڈي جگه
gem,گوهر ـ جوائر ـ نگينے ـ قيمتي پھتر
geminate,جڑوان
gemination,ازدواج ـ جوڑے جوڑے
gemini,جوزا ـ متھن
gemmate,کليوں دار ـ کلياں آنا ـ غنچے نکالنا
gemmation,شگوفے پھو ٹنا ـ شگوفوں گي ترتيب
gemmiferous,جواهر خيز ـ پر شگوجه
gemmy,جواهر جيسا
gendarme,سوار يا پياده سپائي
gendarmerie,فرانس کي جوجي پوليس کا دسته
gender,مذکر مونث
genealogical,نسلي
genealogist,نسب دان کا عالم ـ نسب دان
genealogy,شجره نسب
genera,جنس ـ قسم
general,عام مروجه ـ وامه ـ کل ـ معمولي ـ مجموعي
generalissimo,متحده لشکروں کا سالار
generality,کليت ـ عموميت ـ عام بات
generalization,تجنیس ۔ تعمیم ۔
generalize,جنس وار کرنا ـ مهم گفتگو کرنا
generalizer,مهم گفتگو کرنے والا
generally,علي الوموم ـ اکثر اوقات
generalreader,هر طرح کي کتابيں پڑھنے والا
generalship,جرنيل کا عهده
generate,پيدا کرنا ـ خلق کرنا ـ بناناا
generation,نشو و نما ـ اولاد ـ نسل ـ پشت
generative,پيدائش کي صلاحيت رکھنے والا
generator,پيدا کرنے والا
generic,جنس کا ـ جنسي
generosity,عالي همتي ـ فاخدلي
generous,عالي همت ـ دريا دل ـ سخي í فياض
generously,فياضي سے
genesis,ابتدا ـ آغاز ـ پيدائش
genet,مشک بلاؤ کا سمور
genetic,اصل ـ پيدائش عالم کے متعلق
genetically,علم الخلق کي رو سے
geneva,جنيوا
genial,مفيد ـ خوشگوار ـ صحت نخش ـ توليدي
geniality,زنده دلي
genially,زنده دلي سے
genie,جن ـ باري مخلوق ـ آگ کي مخلوق
genital,توالد و تناسل کے متعلق ـ نسل کے متعلق ـ اعضائے تناسل
genitive,اضافي ـ مضاف اليه
genius,محافظ روح ـ جن ـ همزاد ـ خصلت
gent,مهذب ـ خليق ـ شاهسته
genteel,ترتيب يافته ـ خليق ـ ساهشته
gentile,پت پرشست ـ مشرک ـ کافر
gentility,شرافت ـ مروت ـ اصالت
gentle,شريف ـ نجيب ـعالي
gentlefolk,چھوٹي مکھي ـ شريف لوگ
gentleman,شريف ـ بزرگ ـ زي مرتبه
gentlemanfarmer,زميندار جو اپني ساري زميں پر کاشت کرتا هو
gentlemanlike,شريفوں کي طرح
gentlemanliness,شرافت ـ خوش رويگي
gentlemanly,شريفانه ـ شريفوں کي لائق
gentleness,نرمي ـ شائستگي ـ شرافت
gentler,بردباد
gentlewoman,شريف زادي
gently,دھيمے سے
gentry,شرفا ـ خواص ـ شريف خاندان کے لوگ
genuflect,عبادت کے وقت جھکنا
genuflection,رکوع
genuine,اصلي ـ خالص ـ کھرا ـ بے ميل
genuinely,حقيقي طور پر ـ سچ مچ
genuineness,اصليت
genus,جنس ـ قسم
geo,سابقه ـ زمين کا
geodesist,پيمائش ارض کا ماهر
geodesy,بفقات الارض کا علم
geodetically,پيمائش زميں کي رو سے
geognosy,کسي علاقے کي زمين کي ساخت ـ طبقات الارض کا علم
geographer,علم جعرافيه کا ماهر
geographic,جغرافيائي
geographically,طبعي ـ حالات کے لحاظ سے
geography,علم جغرافيه
geologist,ماهر ارضيات
geologize,طبقات الارض کي تحقيقات کرنا
geology,ارضيات
geomancy,علم الاعداد ـ جفر
geomantic,رمل کے بارے ميں ـ علم الاعداد کے متعلق
geometer,مهدس ـ اقليدس دان
geometric,هندسے کے متعلق
geometrically,از روئے علم هندسه
geometrician,اقليدس جاننے والا
geometry,اقليدس ـ هندسه
geophagist,وه شخص جسے مٹي کھانے کي بيماري هو
geophagy,مٹي کھانے کي بيماري
geoprgic,دهقاني نظم
george,ولي جارج ـ انگلستان کا روحاني محافظ
georgette,باريک ريشمي کپڑا ـ جارجيٹ
geranium,ايک جنگلي درخت ـ ايک پھول کا پودا
germ,وه کله جو پهلي بار بيچ سے نکلتا هے ـ جنين ـ نيضه ـ جرثومه
german,نسلي عزيز ـ سگا ـ رشته دار ـ جرمني کا ـ ملک جرمني کا باشنده
germane,کسي موضوع سے متعلق رکھنے والا
germanizm,المانويت ـ جرمن زبان کا محاوره
germanomania,جرمن زبان کا محاوره
germanophobia,جرمن بننے کا خبط ـ جرمن پرستي
germany,جرمن کي هر چيز کو برا سمجھنا
germicidal,ملک جرمني
germicide,جراثيم کش
germinate,جاثيم کش ـ مارنے والي
germination,پيدا کرنا ـ اگانا ـ نکلنا
gerontocracy,اگنا ـ باڑه ـ نمو
gerrymander,ضعيفوں اور بوڑھوں کي حکومت
gerund,ناجائز اثر ٹال کر کسي سيسي جماعت کو انتخاب ميں کامياب کرنا
gestation,اسم فعلي
gestic,حمل ـ زمانه حمل
gesticulate,اشاروں سے متعلق
gesticulation,اشاروں سے بات کرنا ـ بقل کرنا ـ بھاؤ بتانا
gesticulatory,اشاروں سے کسي مفهوم کو ظاهر کرنا
gesture,اشارتي ـ اشاروں والي
gesturer,اعضا کي حرکت ـ جسم کي اندازه ـ احساس يا جذبه کا اظهار کرنا
get,اشارے سے مطلب ظاهر کرنے والا
getable,پيده کرنا ـ حاصل کرنا ـ کماناí پانا í پاس رکھا
getbyheart,کمانے کے قابل ـ پيدا کرنے کے قابل ـ قابل برداشت
getup,زباني ياد کرنا
getwind,لباس ـ انداز ـ وضع ـ طرز ـ کتابت ـ جلد ـ بندي وغيره
gewgaw,پھيل جانا ـ مشهور هو جانا
geyser,کٹھ پتلي ـ کھلونا
ghastliness,گرم پاني کا چشمه
ghastly,بھيا نک شکل و صورت
ghee,بھيانک ـ وحشت ناک ـ مرده سا
ghetto,گھي
ghost,روح ۔ ہمزاد ۔ دم ۔ جان ۔ روح القدوس ۔
ghostlike,روح ـ همزاد ـ دم ـ جان ـ روح القدوس
ghostly,بھوت کي طرح ـ سايه کي طرح
ghoul,روحاني ـ پاک ـ ديني ـ مذھبي
ghoulish,غول بيابائي ـ غول
giant,غول جيسا
giantess,جن ـ وعفويت ـ غير معمولي ـ فرات کا آدي
gibber,غير معمولي قد و قامت کي عورت ـ ديوئي
gibberish,تيزي سے بولنا
gibbet,بے معني شور
gibbon,سولي ـ پھانسي کا تخته
gibbosity,لانبے هاتھ پير کا بندر
gibe,لعنت ملامت کرنا ـ طعنے دينا ـ آوازے کسنا ـ مذاق اڑانا
giber,مزاق ارانے والا ـ طعنے دينے والا
gibingly,لعنت ملامت سے
giblets,قاز کے وه اعضا جو پکانے سے پهلے کاٹ کر الگ کر دئے جاتے هيں
giddily,بے فکري ـ بے خودي
giddiness,کم ظرفي ـ بے خودي
giddy,چکراتا هوا ـ گھمتا هوا ـ پھرنا هوا
gift,پخشش ـ تحفه ـ هديه
gifted,مالک ـ هوشيار ـ قابل
gig,هلکي گاڑي ـ ٹم ٹم
gigantic,عفريت ـ صورت ـ قوي هيکل
giggle,دانت نکالنا ـ قهقهے مارنا ـ ره ره کر هنسنا
giggler,قهقهے مارنے والا
gild,سونے کا پاني پھيرنا ـ سونا چڑھانا ـ ملمع کرنا
gildedyouth,فيشن ايبل نوجون
gilder,گلٹ کرنے والا
gilding,گلٹ کا کام
gill,گلپھڑا ـ جبڑے پر کا گوشت ـ مچھلي کا شکار کرنا ـ جال سے پکڑنا
giller,مچھلي کا شکار کرنے والا
gillie,خدمت گار ـ خادم ـ غلام ـ لونڈا
gillyfolwer,ايک قسم کا پھول جس سے لونگ کي خوشبو آئي هے
gilt,ملمع ـ جھول
gimcrack,چيز ـ نمائش شے ـ کھلوناـ نکمي آرائشي چيز
gimcrackery,نمائشي سامان ـ کھلونے
gimlet,سوراغ کرنے کا آوزار ـ برما
gimmal,زنجير ـ سائکل
gimp,ايک قسم کي ريشمي ٹور
gin,پھندا ـ دام ـ جال ـ روئي اونٹنے کي مشين
gingal,بندوق جو گھوڑی پر رکھ کر چلائی جائے ۔
ginger,ادرک ـ جوش و خروش ـ تيزي
gingerade,ادرک کي شراب
gingerly,ڈرتے ڈرتے ـ تهايت احتاط سے
gingery,تيز ـ جوشيلا
gingham,دھاري دار کپڑا ـ سوت کا رنگين کپڑا
gippy,مصري سپائي
gipsy,ايک خانه بدوش قوم کا فرد ـ سرير عورت
giraffe,افريقه کا ايک جانور
girandole,آتش بازي کي چرخي ـ روشني کا جھاڑ
gird,کسنا ـ جکڑنا ـ بانڈھنا
girder,کڑي ـ دھني
girdle,کمر بند ـ توا
girdler,گھيرنے والا
girl,لڑکي ـ بچي ـ کنواري ـ دوشيزه
girlfriend,لڑکي دوست
girlhood,دوشيزگي ـ بچپن
girlish,شرميلي ـ بھولي ـ معصوم
girlishness,شرميلا پن
girth,زير بند ـ بانڈھنا ـ کسنا
gist,خلاصه ـ اصل ـ نچوڑ
give,دينا ـ عنايت کرنا ـ بخشناـادا کرنا
giveable,دينے کے قابل ـ قابل مرحمت
given,دے چکا
giver,دينے والا
gizzard,حوصله ـ سنگدانه
glabrous,چکني کھال کا ـ بغير بالوں اور روئيں کے
glacial,برف کا ـ برفاني
glaciate,برف سے چکنا کيا هوا
glacier,برف کا توده
glaciered,برف کے تودوں سے ٹھکا هوا
glad,خوش و خرم ـ مسرور ـ خوشي ميں اضافه کرنے والا
gladden,مسرور کرنا ـ خوش کرنا
gladder,خوش کرنے والا
glade,جنگل کے اندر کھلا هوا ميدان
gladiate,شمشير زئي کرنا ـ مناظره کرنا
gladiator,مناظره کرنے والا شخص
gladly,شاداں و فرحاں
gladness,شادماني ـ مسرت
gladsome,خوش و خرم ـ محفوظ
gladsomeness,مسرت ـ سرور ـ انبساط
gladstone,ايک قسم کا هلکا سفري بيگ
glair,ليسدار شے ـ چپکنے والا مساله
glamor,حسن ـ سحر ـ جادو کرنا ـ موه لينا
glamorous,مسحور کن ـ جازب نظر ـ نظر فريب
glamour,نظر فريب حسن ـ سحر ـ جادو ـ موه ليناـ جادو کرنا
glance,جھلکـ نظر ـ سرسري نظر ـ اشارے کرنا ـ جھلکنا
gland,غدود ـ گانٹھ ـ گلٹي
glanders,گھوڑوں کي ايک بيماري
glandiform,گلٹي جيسا
glandular,غدودي
glanduliferrous,غرودوں والا ـ پرغدود
glandulous,گلٹي دار ـ غدودي
glare,جھلکنا ـ دمکنا ـ چونکا دينا
glaringly,غضب آلود نگاه سے
glarious,انڈے کي سفيدي جيسا
glary,غضب آلوده ـ خيره کن
glass,شيشه ـ کانچ ـ زجاج شيشے کے برتن ـ آهينه
glassy,کانچ سا ـ شيشے کي مانند ـ شيشے کا ـ بے رونق ـ بے نور ـ صاف شفاف
glaucoma,آنکھ کي بيماري
glaucous,آبي ـ هلکا سبز
glaze,شيشه لگانا يا جڑنا ـ شيشه دار کھڑکياں لگانا ـ آنکھ کا پتھرا جانا
glazer,شيشے لگانے والا
glazier,شيشه ساز
glazing,شيشے جوڑنے کا کام
gleam,شعاع ـ کرن ـ دھيمي روشني ـ آبداري
gleamy,چمکتا هوا
glean,چننا ـ جمع کرنا ـ خوشه چيني کرنا
gleanable,جمع کرنے کا قابل
gleaner,جمع کرنے والا ـ اکٹھا کرنے والا
gleaning,انتخاب
glebe,دھرتي کھيت
glee,خوشي ـ شادماني  ـ رنگ رلياں
gleeful,مسرور ـ شادمان
gleefully,شادماني سے
gleeman,مسرور آدمي ـ خوش مزاج شخص
gleet,مواد ـ پيپ
glen,تنگ دره
glib,چمکنا ـ صاف ـ هموار ـ بے لگام
glibber,پھسلنے والا
glibly,چرب زباني سے
glibness,روائي ـ چرب زباني
glide,بے آواز چلنا ـ آهسته آهسته حرکت کرنا ـ پھسلنا ـ خاموشي سے بهنا
glider,آهسته آهسته گزرنے والا
glidingly,غير معلوم طريقے سے ـ سيک رفتاري سے
glim,روشني ـ چراغ ـ شمع
glimmer,ٹمٹمانا ـ جھلک ـ شماع
glimpse,جھلک ـ سرسري جلوه ـ عارضي تجلي
glimpser,ايک نظر ڈالنے والا
glint,جھلک دکھانا ـ چمک چمک ـ جھلک
glisten,ره ره کر چمکنا ـ جھلک
glitter,روشن هونا ـ تابان هونا ـ درخشان هونا
glittering,منور ـ درخشان
gloaming,شفق ـ دھندلکا
gloat,پر شوق نگاهوں سے ديکھنا
gloater,پر شوق نگاهوں سے ديکھنے والا
gloatingly,تمنا سے ۔ للچائی ہوئی نظر سے ۔
globe,گولا ـ گول چيز ـ زمين
globetrotter,زمين کا پيدل سفر کرنے والا
globisty,گولائي ـ کربت
globose,کروي ـ گول
globular,خون کے قطروں پر مشتعل ـ مدود گول ـ کروي
globule,جھوٹا کره ـ قطره ـ گولي
glomerate,گھنا جھاڑي دار ـ گچھا بنا هوا ـ گولي بنا هوا
glomerule,پھولوں کا گچھا ـ اعصاب گچھا
gloom,اندھيرا هو جا نا ـ بے رونق نظر کر دينا ـ اداس نظر آنا
gloominess,تاريکي ـ افسردگي
gloomy,بے نور ـ اداس ـ ملول
glorification,حمد و ثنا ـ تکبير ـ تمجيد
glorify,حمد و ثنا کهنا ـ تکبيرکهنا
glorious,جليل القدر ـ عظيم الشان ـ مشهور ـ معروف
gloriously,شهرت سے ـ شان سے
glory,تعريف ـ توصيف ـ اترانا
gloss,چمک دمک ـ جھلک حاشيه ـ جلا دينا ـ بے جا تاويل
glossary,فرهنگ ـ فهرست ـ حاشيه ـ شرح
glossiness,ظاهري چمک دمک ـ سطحي آب
glossy,چمکيلا
glove,آهني ـ اوني ـ سستانے بنانا ـ ريشمي دستے ـ دستانے مهيا کرنا
glover,دستانے بنانے والا
glow,ديکنا ـ دمکنا ـ لهکنا ـ لال هونا ـ جوش ميں آنا
glower,قهر آلود نظروں سے ديکھنا
gloweringly,غصه کي نگاه سے
glowworm,کرمک شب تاب ـ جگنو
glucose,انگوري شکر
