i,انگريزي حروف تهجي کا نواں حرف
iambic,کسي نظم جسکا پهلا جز غير تاکيدي هو اور دوسرا تاکيدي
iberian,ايبريا کي زبان اور باشنده
ibex,کوه ايلپس اور اپنائن کا بکرا
ibis,ايک قسم کا پرنده
ice,برف هو جانا ـ جمنا ـ برف
iceberg,برف تا توده
icebox,برف خانه
icefall,برف کا گرنا
icehouse,برف خانه
ichneumon,ايک قسم کا نيولا
ichnography,نقشه کشي ـ خاکه کشي
ichor,ايسا ماده جو ديوتاؤں کي رنگوں ميں خون کي بجائے هوتا هے ـ زرد آب
ichorous,ديوتائي ـ زرد آبي
ichthyologist,ماهر سمکيات
ichthyology,مچھليوں کا علم
icicle,برف کا علم
iciness,بے پروائي ـ سرد مهري
icing,کسي چيز پر شکر کي تهه
ickle,تھوڑا سا ـ ذرا سا
ickonography,بتوں اور مورتيوں کا تذکره
icon,بت ـ مورتي ـ شبيه ـ مجسمه
iconic,مورتي کا ـ بت کا
iconoclast,قديم رسموں کو توڑنے والا ـ بت شکن
iconolater,بت پرستي
iconomachy,بت يا تصوير پرستي کي مخالفت
icy,برف سے معمور ـ برف کا
icymanners,سرد مهري ـ بے مروتي
idea,خيال ـ تصور ـ فکر ـ رائے ـ ادراک
ideal,وهمي ـ قياس ـ خيالي مثالي
idealism,تصوريت ـ مثاليت
idealist,تصوري ـ عيني ـ مثال پسند
idealization,کامل نمائي
idealize,کامل ظاهر کرنا
ideate,ذهن ميں لانا ـ تصور کرنا
ideation,عمل تصور
identical,اسي شکل کي ـ وهي ـ ويسي هي
identification,پهچان ـ شناخت
identifier,شناخت کرنے والا
identify,ايک سمجھنا ـ ايک جاننا ـ پهچاننا
identity,کامل مطابقت ـ يکسانيت ـ نام و نشان
ides,قديم روميوں کي تقويم ميں بعٰض مهينوں کي پندرهويں اور تيرهويں تاريخيں
idiocy,ضعف عقل ـ سودا ـ خبط
idiom,محاوره ـ بولي
idiomatic,با محاوره ـ لسائي طور پر درست
idiomatically,بامحاوره
idiopathy,اصلي عارضه
idiosyncrasy,مخصوص جذبه يا خيال ـ مخصوص طرز بيان
idiot,احمق ـ ساده لوح ـ بيوقوف
idiotic,احمقانه
idiotical,احمقانه پن
idiotically,احمقانه پن سے
idle,بے کار ـ بے شغل ـ سست ـ مجهول ـ ناکاره ـ بے فائده ـ ضائع کرنا
idleness,آرام طلبي ـ بے کاري
idler,کاهل
idly,کاهلي سے
idol,بت ـ مورتي ـ صنم ـ محبوب
idolater,بت پرستي ـ پوجنے والا
idolatrous,بت پرستي سے متعلق
idolatry,پر جوش محبت ـ صنم پرستي
idolise,بت بنانا ـ معبود بنا کر پوجنا ـ بت پرستي کرنا
idoliser,بت پرستي کرنے والا
idolism,بت پرستي
idolization,معبود بنا لينا ـ حد سے زياده احترام ـ بت پرستي
idolize,بت بنانا ـ معبود بنا کر پوجنا ـ بت پرستي کرنا
idolizer,معبود بنا کر پوجنے والا
idyl,ديهاتيوں کے چھوٹے چھوٹے گيت
idylist,ديهاتي گيت لکھنے والا
idyll,ديهاتيوں کے چھوٹے چھوٹے گيت
idyllist,ديهاتي گيت لکھنے والا
if,اگر ـ جيسے ـ بالفرض
igneous,آگ کا ـ آگ کا بنا هوا
ignitable,آتش گير ـ جلنے کے قابل
ignite,آگ لگانا ـ آگ پکڑنا
igniter,آگ لگانے والا
ignition,آتش گيري
ignoble,کمينه ـ کم ظرف ـ کم اصل
ignominious,باعث رسوائي
ignominy,بدنامي ـ رسوائي
ignoramus,جاهل ـ احمق
ignorance,ناداني ـ احمق
ignorant,بے علم ـ ناواقف ـ جاهل
ignorantly,بے علمي سے
ignore,کچھ خيال نه کرنا ـ تجاهل پرتنا ـ نظر انداز کرنا ـ انجان بننا
ignorer,نظر اندار کرنے والا ـ خيال نه کرنے والا
ignoring,انجان بننا
iliac,پيٹره کے متعلق ـ کولھے کي هڈي کا
iliad,هومر کي مشهور رزميه نظم
ilk,اهي ـ اسي کا
ill,عليل ـ بيمار
illation,حاصل ـ نتيجه ـ استنياط ـ پھل
illative,نتيجه خيز ـ استخراجي
illegal,غير قانوني ـ خلاف قانون
illegality,ناجائز هونا
illegally,غير قانوني طور پر
illegibility,ايسي تحرير جو نه پڑھي جاسکے ـ بدخطي
illegible,جو پڑھا نه جاسکے ـ بدخط
illegitimacy,غير شرعي هونا ـ خلاف قانون هونا
illegitimate,ناجائز ـ خلاف شرح
illegitimately,ناجائز طور پر
illiberal,کنجوس ـ بے فيض ـ بے مروت
illiberality,انائت ـ تنگ دلي ـ بخل
illiberally,تنگ دلي سے ـ کمينه پن سے
illicit,ناروا ـ ناجائز ـ خلاف قانون
illicitly,ناجائز طور پر
illimitable,بے حد ـ لامتناهي ـ لامحدود
illiteracy,کم علمي ـ جهل
illiterate,جاهل ـ بے علم ـ ان پڑھ
illiterateness,ان پڑھ هونا ـ بے علمي ـ ناخواندگي
illness,روگ ـ بيماري ـ مرض ـ شرارت ـ بدي
illogical,بے دليل ـ خلاف منطق ـ غير معقول
illogicality,غير معقول هونا
illume,روشن کرنا ـ درخشاں کرنا
illuminable,روشن کرنے کے قابل
illuminate,روشن کرنا ـ منور کرنا ـ درخشاں کرنا
illumination,درخشائي ـ تاباني
illuminative,روشن کرنے والي
illuminator,روشن کرنے والا
illumine,روشن کرنا ـ تابان کرنا ـ قلب و دماغ کو روشن کرنا
illusion,فريب ـ دھوکا ـ فريب نظر
illusionary,فريب خيالي
illusionist,هستي کو فريب نظر سمجھنے والا
illusive,پرفريب ـ فريب ده
illusiveness,فريب دهي ـ دھوکا دهي
illusory,پر فريب ـ باطل کا
illustrate,شرح کرنا ـ توضيح کرنا ـ روشن کرنا
illustration,تشريح ـ بيان
illustrative,تشريحي ـ تمثيلي
illustrator,مثالوں اور نقشوں سے واضح کرنے والا
illustrious,روشن ـ تاب دار ـ مشهور ـ معروف ـ عالي مرتبه
image,مورت ـ شکل ـ صورت ـ مجسمه
imagery,صورتيں ـ مورتيں ـ مجسمے
imaginable,قابل تصور
imaginary,قياسي ـ فرضي
imagination,تخثيل ـ تصور
imaginative,پر خيال ـ پر تخيل ـ مضمون خيز
imaginatively,پر خيالي سے
imaginativeness,بلند فکر هونا ـ صاحب تخيل هونا
imagine,تصور کرنا ـ قياسي کرنا ـ خيال کرنا
imaginer,تصور کرنے والا ـ خيال کرنے والا
imbecile,ضعيف العقل ـ بيوقوف
imbecility,ناتوائي ـ نامردي
imbibe,پي لينا ـ جذب کر لينا ـ چوس لينا
imbiber,جذب کرنے والا ـ پي لينے والا
imbibition,جمع کرنا ـ جذب کرنا
imbroglio,پيچيده معامله ـ گتھي ـ گهري سازش
imbrue,آلوده کرنا
imbue,رنگنا ـ گهرا رنگنا
imitable,پيروي کے قابل
imitate,نقل کرنا ـ پيروي کرنا ـ تقليد کرنا
imitation,پيروي ـ اتباع ـ نقل
imitative,تقليدي ـ نقلي ـ اتباع کرنے والا
imitator,پيروي کرنے والا
immaculate,بے عيب ـ بے داغ ـ بے گناه ـ معصوم ـ پاک ـ صاف ـ مصفا
immaculately,بے عيبي
immaculateness,صفائي ـ بے داغ هونا
immaterial,غير مادي ـ غير مجسمي ـ باقابل لحاظ
immaterialism,يه عقيده که همارے شعور سے عليحده ماده کا کوئي وجود نهيں ـ شعوريت
immaterialist,اعيان ثانته کے علمي وجود کا عقيده
immature,کچا ـ خام ـ نامکمل
immaturity,نابالغي ـ ناتجربه کاري
immeasurable,بے حد ـ بے پايان ـ عظيم
immeasurably,بے اندازه ـ بے حد
immediate,قريب ـ نزديک ـ جلد ـ فيالفور ـ حاضر
immediately,في الفور ـ جلد
immemorial,پرانا ـ قديم ـ عميق
immense,لا انتها ـ بے حد ـ عظيم
immensely,بکثرت ـ نهايت
immerse,ڈبونا ـ دفن کرنا ـ گاڑنا ـ غوطه دينا
immersion,اغراق ـ غوطه خوري
immigrant,مہاجر ۔ غریب الوطن ۔
immigrate,وطن تبدل کرنا ـ کسي ديس ميں آ بسنا ـ هجرت کرنا
immigration,ترک وطن ـ هجرت ـ غير ملک کي سکونت پذيري
imminence,نزول
imminent,سر پر کھڑا ـ نازل هونے والا ـ قريب
imminently,سر پر منڈلاتے هوئے
immitigable,نرم نه هونے والا
immix,ملاوٹ کرنا ـ شرکت کرنا
immixture,آميزش ـ ملاوٹ
immobile,ساکن ـ ناقابل حرکت
immobilization,غير متحرک کرنا
immobilize,بے حرکت کرنا
immobilizer,بے حرکت کرنے والا ـ غير متحرک کرنے والا
immoderate,غير واجب ـ غير معقول
immoderately,غير معتدلي
immoderation,غير معتدل ـ غير واجب
immodest,شيخي باز ـ بدتميز
immodestly,بے حيائي سے
immodesty,بے غيرتي ـ بے حيائي
immolate,بھينٹ چڑھانا ـ قرباني دينا ـ قرباني کرنا
immolating,قرباني
immolation,چڑھاوا ـ قرباني
immoral,برا ـ زبوں ـ فاسق
immorality,بدفعلي ـ بدکرداري
immorally,بداخلاقي سے ـ فاجرانه
immoratalizatio,حيات ابدي نخشنا ـ زنده جاويد کرنا
immortal,لافاني ـ قائم ـ دائم
immortality,ابديت ـ هميشگي
immortalize,حيات ابدي دينا ـ زنده جاويد کرنا
immortally,بهت ـ بے حد
immovable,ساکن ـ بے حرکت
immune,محفوظ ۔ مامون ۔
immunity,چھٹکارا ـ بے خوفي ـ معافي
immunization,معافي ـ مستشني
immunize,معافي دينا ـ محفوظ کرنا
immure,چار ديواري ميں بند کرنا ـ گھيرنا ـ قيد کرنا
immutability,ايک حال ميں رهنا ـ دوام
immutable,ناقابل تغير
imp,اڑنے کے قابل بنانا
impact,تصادم هونا ـ ٹکر هونا ـ داهنا
impacter,زور دبانے والا
impaction,ٹکر ـ تصادم
impair,بگاڑنا ـ خراب کرنا ـ اتارنا
impale,جسم ميں ميخيں ٹھونک کر هلاک کرنا ـ نوک دار لکڑيوں کا جنگلا لگانا
impalement,جنگلا بندي ـ سزا
impalpable,غير محسوس ـ نامعلوم
impanel,فهرست ـ جيوري
imparadise,روحاني خوشي بخشنا ـ انتهائي مسرت حاصل هونا
impark,سير گاه ميں جانوروں کو بند کرنا
imparkation,جانوروں کي حفاظت گاه تيار کرنا
impart,عيايت کرنا ـ بخشنا ـ عطا کرنا
imparter,عنايت کرنے والا ـ بخشنے والا
impartial,غير متعصب ـ بے لاگ ـ کھرا
impartiality,منصفانه عمل ـ بے لاگ رويه
impartible,ناقابل تقسيم ـ کهنے کے لائق
impassability,جس سے گزرنا نا ممکن هو
impassable,ناقابل گزر
impasse,سخت مشکل ـ بند گلي
impassible,بے حس ـ بے احساس
impassibly,بے حسي ـ بے احساسي
impassion,نفساني خواهشات ـ جذبات کو بھڑکانا
impassive,بے حس ـ جذبات سے معري
impassiveness,جذبات سے عاري هونا
impaste,گوند سے چپکانا ـ تصوير پر رنگ تھوپنا
impatience,بے تابي ـ بے صبري
impatient,بے صبر ۔ بے چین ۔
impatiently,بے قراري سے ـ بے صبري سے
impawn,گروي رکھنا ـ رهن رکھنا ـ قول دينا
impayable,بيش قيمت ـ بے بها
impeach,الزام لگانا ـ اعتراض کرنا ـ کسي کے کردار پر حمله کرنا
impeachable,قابل مواخذه
impeacher,الزام لگانے والا
impeachment,بغاوت کا الزام ـ مقدمه
impeccable,پاک ـ بے گناه ـ بے خطا
impecunious,غريب ـ مفلس ـ نادار
impecuniously,غربت ـ مفلسي
impede,باز رکھنا ـ روکنا
impeder,باز رکھنے وال  ـ روکنے والا
impediment,روک ـ مزاحمت
impel,ريلنا ـ دھکيلنا ـ اکسانا
impellent,حرکت ميں لانے کي قوت رکھنے والا
impeller,اکسانے والا
impend,آويزاں هونا ـ سر پر چھانا يا منڈلانا ـ قريب هونا
impendence,معلق هونا ـ قربت
impendent,سر پر منڈلاتا هوا ـ قريب الوقوع
impenetrability,ناقابل فهم هونا
impenetrable,ناقابل دخول ـ باقابل گزر
impenetrablenes,ناقابل گزر هونا ـ ناقابل دخول هونا
impenetrate,بهت گهرا اتر جانا ـ اندر چلا جانا
impenitence,بے حيائي
impenitent,جو توبه نه کرے
impenitently,بے حيائي سے
imperative,بصورت آمر ـ آمرانه
imperativeness,قطعيت ـ آمريت ـ اهميت
imperator,مير عسکر ـ قائد ـ امير
imperceptible,غير محسوس ـ نامعلوم
imperfect,خام ـ کمزور ـ عيب دار
imperfection,عيب ـ قصور ـ خامي
imperforate,بے منه ـ بے سوراخ
imperial,شائي ـ خسروي ـ سلطنت کے متعلق
imperialism,برطانيه کي توسيع سلطنت کي پاليسي
imperialist,شاهي حکومت کا حامي
imperially,شان و شوکت سے ـ شاهانه طور پر
imperil,خطره مول لينا
imperious,مغرور ـ منه زور ـ تحکم پسند
imperiously,تحکم پسندي
imperishable,لازوال ـ ديرپا
impermanent,غير مستقل
impermanently,تغير پذيري
impermiable,غير جاذب ـ غير نفوذ پذير
impersonal,غير شخصي ـ لاشخصي
impersonate,اپنے آپ کو دوسرا ظاهر کرنا ـ دوسرے کا نام اختيار کرنا ـ صورت بنانا
impersonation,فرضي شخص بننا ـ تبديل پينت
impersonator,تلبيس کرنے والا
imperspicuity,الجھن ـ کدورت ـ ميلا پن
impertinence,بے ادبي ـ شوخي
impertinent,بے تعلق ـ بے ميل
imperturbable,پر سکون ۔ مطمئن ۔
impervious,دشوار گزر
imperviousness,ناقابل گزر هونا ـ ڈھيٹ پن
impetuosity,جوش ـ شدت
impetuous,تيز ـ شدت ـ تند ـ سخت ـ سرگرم
impetuousness,جلد بازي ـ تند خوئي
impetus,قوت رفتار ـ قوت
impiety,نا پرهيزگاري ـ ناخدا ترسي ـ الحاد
impinge,ٹکر دينا ـ تصادم هونا
impingement,صدمه ـ ٹکر
impinger,ٹکر دينے والا
impious,ناترس ـ فاسق ـ فاجر
impish,شرير لڑکے کي طرح
impishness,شرارت
implacability,سنگ دلي
implacable,سخت ـ سنگدل
implacably,سنگدلي سے
implant,جمانا ـ لگانا ـ هونا ـ دل ميں داخل کر دينا
implantation,اثر پذيري ـ دل نشيني
implanter,جمانے والا
implement,اوزار ـ هتھيار ـ سامان
implicate,پيچ ميں ڈالنا ـ ماخوذ کرنا ـ معني نکلنا
implication,پيچ ـ الجاؤ
implicative,نتيجه خيز ـ پر معني ـ پيچ دار
implicit,کامل ـ پورا
implicitfaith,کامل ايمان ـ کامل يقين
implicitly,کامل يقين سے
imploration,منت ـ التجا
implore,منت کرنا ـ التجا کرنا ـ آرزو کرنا
implorer,منت کرنے والا
imply,دلالت کرنا ـ معني کي طرف اشاره کرنا ـ مفهوم هونا ـ مواد هونا
impolite,بے ادب ـ بد اخلاق
impoliteness,روکھا پن ـ ناشائستگي ـ بد تميزي
impolitic,خلاف مصلحت ـ نامناسب
imponderable,هلکا ـ بے وزن ـ گهرا
import,در آمد کرنا
importable,قابل در آمد
importance,اهميت ـ رتبه ـ وقار
important,اهم ـ بھاري ـ قابل لحاظ ـ قابل غور
importation,درآمد
importer,درآمد کرنے والا
importunate,سخت اصرار کرنے والا ـ نهايت ضروري
importunity,ضد ـ اصرار
impose,سر پر رکھنا ـ ذمے کرنا ـ مجبور کرنا
imposer,مجبور کرنے والا
imposeupon,دباؤ ڈالنا ـ آنکھوں ميں خاک ڈالنا
imposingly,دباؤ ڈالتے هوئے
imposition,مقرر کرنا ـ عائد کرنا
impossibility,ناممکن هونا ـ امر محال
impossible,غير ممکن ـ محال ـ نا ممکن
impost,محصول ـ ٹيکس ـ چنگي
imposter,دغا باز ـ مکار ـ ٹھگ
impostor,دغا باز
imposture,فريب ـ مکر ـ چھل ـ عياري ـ حليه سازي
impotence,کمزوري
impotency,ضعف
impotent,ضعيف ـ ناتوان ـ کمزور ـ بے مقدور ـ مجبور
impotently,بے مقدوري
impound,مويشي باندھ رکھنا ـ چار ديواري ميں بند کرن دينا ـ قبضه کر لينا
impoundable,بند کرنے کے قابل
impoverish,کنگال کر دينا ـ غريب بنانا ـ مفلس کرنا ـ دبلا کرنا
impoverisher,کنگال کرنے والا
impoverishment,کمزوري ـ افلاس
impracticabilit,صدي هونا ـ باقابل عمل هونا
impracticable,ناقابل عمل ـ ناممکن الوقوع ـ دشوار گزار
imprecate,لعنت بھيجنا ـ بددعا دينا ـ کوسنا
imprecation,لعنت ـ نفرت
imprecator,بددعا دينے والا
imprecatory,لعنت کي ـ بددعا کي
impregnable,ناقابل تسخير ـ فتح نه هونے والا
impregnate,حامله کرنا ـ زرخيز کرنا ـ کوٹ کوٹ کر بھرنا
impregnation,حمل ـ گابھ
impresario,کھيل تماشے کے منتظم
impress,نقش کرنا ـ مهر لگانا ـ ذهن نشين کرنا
impresser,مهر لگانے والا ـ نقش کرنے والا
impression,داب ـ ٹھپا ـ نقش
impressionable,جلد متاثر هونے والا
impressionism,اثريت
impressive,صورت پذير ـ پراثر
impressively,صورت پذيري
impressiveness,مؤثر هونا ـ دل نشيني
imprest,پيشگي
imprimatur,کتاب وغيره چھاپنے کي سرکاري اجازت ـ اجازت طبع
imprint,ٹھپا ـ مهر  ـ دل نشين کرنا
imprinter,ٹھپا لگانے والا ـ دل نشين کرنے والا
imprison,قيد کرنا ـ اسير کرنا ـروکنا
imprisonment,حبس ـ بندي ـ قيد
improbable,ناممکن الوقوع
improbity,بدمعاشي ـ شرارت ـ بے ايماني
impromptu,بے ساخته ـ برمحل
improper,بے جا ـ نامناسب ـ غلط
impropriate,پادريوں کي يا کليسا کي جائيداد ضبط کرنا
impropriety,غير معقوليت ـ بے جا حرکت
improvability,اصلاح پذيري
improvable,قابل درستي ـ قابل اصلاح
improvableness,ترقي پذيري
improve,سدھارنا ـ درست کرنا ـ سنوارنا ـ ترقي دينا ـ اصلاح کرنا ـ فائده اٹھانا ـ زرخيز کرنا ـ وعظ کرنا
improvement,تعليم و تربيت ـ اصلاح
improver,بهتر کرنے والا ـ سنوارنے والا
improvidence,فضول خرچي ـ لاپروائي
improvident,فضول خرچ ـ مسرف
improvisation,بر محل کلام ـ برجسته نظم
improvise,في البدشهه تقرير کرنا يا شعر کهنا ـ بر وقت ترتيب دينا
improviser,في البدشهه شعر کهنے والا
imprudence,لا پروائي ـ کوتاه انديشي
imprudent,ناتجربه کار ـ بے وقوف
imprudently,ناتجربه کاري
impudence,بدتمیزی ۔ گستاخی ۔
impudent,گستاخ ـ بے ادب
impudently,گستاخي ـ بے ادبي
impugn,رد کرنا ـ اعتراض کرنا
impugnable,قابل گرفت ـ قابل اعتراض
impugner,اعتراخ کرنے والا
impugnment,جرح ـ گرفت
impulse,صدمه ـ دھکا ـ تحريک ـ زور ـ لهر
impulsion,دھکا ـ صدمه ـ ابھارنا ـ اکسانا
impulsive,اکسايا هوا ـ تحريک کننده
impulsiveness,جلد بازي ـ اضطراري حالت
impunity,بريت ـ آزادي
impure,نجس ـ ناپاک ـ بے عصمت
impurity,آلودگي ـ ناپاکي
imputable,الزام لگانے کے قابل
imputation,الزام ـ تهمت
impute,منسوب کرنا ـ الزام لگانا
imputer,تهمت لگانے والا
in,ميں ـ اندر ـ درميان ـ بيچ ـ طرف ـ داخلي مريض
inability,کمزوري ـ ناقابليت
inaccessibility,ادراک سے پرے هونا ـ رسائي سے باهر هونا
inaccessible,رسائي سے باهر ـ ناممکن الحصول
inaccuracy,نقص ـسقم
inaccurate,نادرست ـ غلط
inaction,بيکاري ـ بے علمي ـ بے شعلي
inactivate,بے حرکت کرنا ـ بے شعل کرنا
inactivation,بے شعل ـ بے حرکت
inactive,بے حرکت ـ بے شعل
inactivity,بے عملي ـ سستي
inadaptability,ناسازگاري
inadequacy,کافي نه هونا ـ کسر ـ کوتاهي
inadequate,کم ـ تھوڑا ـ ناکافي
inadmissibility,نامعقوليت ـ ناقابل قبوليت
inadmissible,ناقابل قبول ـ جو منظور نه هو
inadvertence,بے فکري ـ بے فوجهي
inadvertency,بے فکري ـ بے توجهي
inadvertent,بے پروا ـ غافل
inadvertently,غفلت سے
inalienable,ناقابل انتقال ـ غير منفک
inalterable,ناقابل تغير ـ اٹل
inamorato,جاهنے والا ـ عاشق
inane,خالي ـ بے مغز ـ بے عقل
inanely,حماقت سے ـ بے وقوفي سے
inanimate,غير ذي روح ـ بے جان
inanimation,غير ذي روح ـ بے جان هونا
inanity,حماقت ـ بيوقوفي
inappealable,ناقابل مراقعه
inappeasable,فره نه هونے والا ـ سير نه هونے والا
inappetance,خواهش نه هونا ـ آرزه نه هونا
inapplicable,غير موزوں ـ غير مطابق
inapposite,بے محل ـ بے موقع
inappreciable,غير محسوس ـ ناقابل لحاظ
inappreciative,قدر نه کرنے والا ـ نا قدر شناس
inapproachable,رسائي سے بالاتر
inappropriate,نامناسب ـ غير موزوں
inapt,نامناسب ـ نالائق ـ ناقابل ـ نااهل
inaptitude,نامناسبت ـ نااهليت
inaptness,قابليت نه هونا ـ نااهل هونا
inarticulate,جو صاف نه بول سکے ـ غير واضع
inartificial,بے تکلف ـ غير مصنوعي ـ قدرتي ـ ساده
inartistic,بھدا ـ بھونڈا
inasmuch,چونکه ـ کيونکه
inattention,لا پروائي ـ بے توجهي
inattentive,توجهه نه کرنے والا
inattentiveness,بے پروائي ـ غفلت
inaudible,بے آواز ـ دھيما
inaugural,افتتاحي ـ باضابطه ـ کسي تقريب کے سلسلے ميں
inaugurate,نئے عهدے پر کسي کا تقرر هونا ـ تقريب سے آغاز کرنا
inauguration,آغاز ـ افتتاح
inaugurator,افتتاح کرنے والا
inauguratory,تقريبي ـ رسمي
inauspicious,بد شگون ـ منحوس
inauspiciously,بد شگوني سے
inborn,ذاتي ـ خلقي ـ پيدائش ـ قدرتي
inbreeder,هم جنس جانوروں سے نسل لينے والا
inbreeding,هم جنس جانوروں سے نسل لينا
incalculable,بے اندازه ـ بے حساب
incandescence,روشني ـ تاباني
incandescent,جلتا هوا ـ چمکتا هوا ـ دمکتا هوا
incantation,منتر ـ سحر ـ افسوس
incapability,نااهليت ـ معذوري
incapable,نااهل ـ معذور ـ بے صلاحيت
incapacitate,معذور کرنا ـ عاجز کرنا
incapacitation,معذوري ـ نااهليت
incapacitator,بے بس کرنے والا ـ بے کار کو دينے والا
incapacity,قانوني عذر ـ ناقابليت ـ نااهلي
incarcerate,قيد کرنا ـ بند کرنا
incarceration,حنس ـ اسيري
incarcerator,قيد کرنے والا
incarnate,جسماني ـ مجسم
incarnation,مجسم ـ زنده نمونه ـ اوتار
incase,باالفرض
incautious,بے پرواه ـ غير محتاط
incautiousness,نا عاقبت انديشي ـ بے احتياطي
incendiarism,فتنه انگيزي ـ آتش زني
incendiarist,فتنه انگيز
incendiary,آگ لگانے والا ـ جلا دينے والا
incense,مهک ـ خوشبو
incensory,عود داني ـ لوبان داني ـ اگر داني
incentive,محرک ـ ترغيب دينے والا
incept,آغاز کرنا ـ شروع کرنا
inception,آغاز ـ شروع ـ کيمبرج سے ايم اے
inceptive,آغاز کرنے والا
incertitude,يقين نه هونا ـ غير يقيني حالت
incessant,مسلسل ـ متواتر ـ پے در پے
incest,محرمات سے مباشرت
incestuous,محرمات سے مباشرت کرنے والا  ـ حرام کار
inch,انچ
inchoate,ابھي ابھي آغاز هونا
inchoation,آغاز ـ ابتدائ
incidence,تصادم ـ ٹکر ـ ماجرا
incident,عارضي ـ اتفاقي ـ ناگهاني
incidental,اتفاق ـ عارضي
incidentally,اتفاقا ـ عارضا
