recipient,گير نده ـ لينے والا ـ حاصل کرنے والا
reciprocal,باري باري ـ متبادل ـ بالعوض
reciprocally,دونوں طرف سے ـ آپس ميں ملکر
reciprocate,باهم تبادله کرنا ـ باهم ايک دوسرے سے رعائت کرنا ـبدله دينا
reciprocation,آگے پيچھے هٹنے کي حرکت
reciprocity,رعائت باہمی ۔ عمل در عمل ۔ لین دین ۔
recital,تشريح ـ بيان ـ وضيح ـ خواندگي ـ تلاوت
recitation,کسي ڈرامے کا اقتباس سنانا ـدوسرے کا کلام سنانا ـ خوش الحاني سے پڑھنا
recitative,تقرير سے ملتا جلتا گانا ـ نغماتي مکالمه ـ لجن سے ادا کي هوئي تقرير
recite,زباني پڑھنا ـ زباني ادا کرنا ـ خوش الحاني سے پڑھنا
reciter,خوس الحاني سے پڑھنے والا ـ قاري
recivilize,از سر نو مهذب بنانا ـ نئے آداب سکھانا
recked,خاطر ميں لانا ـ خيال کرنا
reckless,بے فکر ـ بے احتياط
recklessly,بد احتياطي سے ـ لاپروائي
recklessness,بے احتیاطر ۔ لاپروائی ۔ من چلا پن ۔
reckon,حساب کرنا ـ شمار کرنا ـ کسي عدد تک گننا ـ اندازي لگانا
reckoner,محاسب ـ جانچنے والا
reckonfor,جواب ده هونا
reckoning,حساب ـ شمار
reckonupon,بھروسه رکھنا
reckonwith,حساب چکانا
reclaim,سدھارنا ـ زمين پر کاشت لانا ـ سنوارنا ـ مهذب بنانا
reclaimable,سدھارنے کے قابل ـ قابل احتجاج
reclamation,بازيابي ـ اصلاح
reclame,شہرت حاصل کرنے کا فن ۔
reclean,دوباره صاف کرنا
reclinate,جھکي هوئي شاخيں ـ جھکا هوا ـ سرنگوں
recline,تکيه لگانا ـ بھروسه کرنا  ـ تکيه کرنا
recliner,تکيه لگانے والا
recluse,تارک الدنیا ۔ گوشہ نشین ۔
recognisable,قابل شناخت ـ قابل اعتراف
recognition,توثيق ـ تصديق ـ تسليم کرنا ـ شناخت ـ اقرار
recognizance,اقرار شناخت ـ اقرار نامه
recognizant,اقرار کرنے والا ـ اعتراف کرنے والا
recognize,پهچاننا ـ شناخت کرنا ـ سمجھنا
recognizer,پهچاننے والا
recoin,پرانے سکوں کو گلا کر نئے سکے تيارکرنا ـدوباره ڈھالنا
recollect,دوباره يا دکرنا ـ دوباري جمع کرنا
recollection,ياداشت ـ قوت حافظه
recolor,دوباره رنگ لگانا
recombine,پھر جوڑنا ـ پھر ملانا
recommence,پھر شروع کرنا  ـ پھرآغاز کرنا
recommend,سفارش کرناـ تعريف کرنا ـ سپرد کرناـ قابل قدر کرنا
recommendable,قابل سفارش ـ سپرد کرنے کے قابل
recommendation,تعريف ـ سفارش
recommendatory,سفارشي ـ تعريفي
recommender,سفارش کرنے والا
recommit,پھر سے حوالے کرنا ـ چالان کرنا ـ دوباره حوالت ميں بند کرنا ـ پھر جرم کا مرتکب هونا
recompact,پھر ملانا ـ پھر جوڑنا
recompensable,معاوضه دينے کے قابل ـ بد له دينے کے قابل
recompensation,بدله ـ معاوضه
recompense,بدله دينا ـ اجر دينا ـ معاوضه ادا کرنا ـ تاوان دينا ـ ادا کرنا
recompenser,معاوضه دئنيوالا ـ ادا کرنے والا
recompilation,دوباره مرتب کرنا
recompile,از سر نو تاليف کرنا ـ دوباره مرتب کرنا
recompiled,دوباره مرتب کيا هوا
recompose,دوباره جوڑنا ـ دوباره بنانا ـ امتزاج کرنا ـ ملانا ـ تسلي دينا
recompute,دوباره گننا
reconcilability,موافقت پذيري
reconcilable,صلح پذير ـ مصالحت پذير
reconcile,مان جانا ـ صلح کرنا ـ موافقت کرنا
reconcilement,تصفيه ـ مصالحت ـ ميل
reconciler,صلح کرنے والا ـ مان جانے والا
reconciliate,تصفيه کرنا
reconciliation,تصفيه ـ صلح ـ موافقت
reconciliator,تصفيه کرنے والا
recondite,پوشيده ـ مخفي ـ پيچيده ـ غير معروف
reconditeness,دشوار پسندي ـ مشکل نويسي
recondition,از سر نو درست کرنا ـ مرمت کرنا
reconfirm,دوباره معلوم کرنا
reconnaissance,فوجي ديکھبھال ـ جاسوسي ـ دشمن کي حرکات و سکنات پر نظر رکھنا
reconnect,دوباره ملانا ـ دوباره جوڑنا
reconnoitre,غنيم کي فوج اور موقع کي ديکھ بھال کرنا ـ پروالي کرنا
reconquer,دوباره فتح کرنا ـطاقت سے قبضه کرنا
reconsider,دوباره غور کرنا ـ نظر ثاني کرنا
reconsolidate,دوباره منجمد کرنا
reconstitute,پھر سے مرتب کرنا ـ اصلي حالت ميں دوباره لانا
reconstruct,پھر سے بنانا ـ پھر سے درست کرنا ـاز سر نو تعمير کرنا
reconstruction,از سر نو تعمير
recontract,دوباره ٹھيکه پر دينا
reconvalescence,بيماري سے نجات پانا ـ از سر نو تندرست هونا ا
reconvert,پھر اصلي مذهب پر لانا ـ پھر بدل جانا
reconvey,دوباره پهنچانا
recook,دوباره پکانا
recopy,دوباره کاپي کرنا
record,قلم بند کرنا ـ ضبط تحرير ميں لانا ـ ياد قائم کرنا ـ کتابچه ـ تاريخ شهاشت
recordable,قابل انداراج ـ تحرير ميں لانے کے قابل
recorder,قلم بند کرنے والا ـ نقل کرنيوالا
recordingangel,کاتب اعمال فرشته ـ اعمال لکھنے والا فرشته
recount,دوباره گننا ـ تفصيل بيان کرنا ـ تشريح کرنا ـنقل کرنا
recoup,دوباره کمي پوري کرنا ـ نقصان کي تلافي کرنا
recoupment,معاوضه ـ حصول ـ تلافي
recourse,توجه ـ رجوع ـ ترکيب ـ تدبير
recover,پھر پالينا ـ پھر حاصل کرنا ـ مرض سے نجات پانا ـ پھر هاتھ آجانا
recoverable,ممکن الحصول
recoverer,پھر حاصل کرنے والا
recovery,افاقه ـ شمنا ـ وصولي ـ استحصال
recreant,نامزد ـ پست همت ـ بد عهد
recreantly,نامزدي
recreate,تجديد کرنا ـ تازه دم  کرنا ـ آرام کرنا ـ جي لگانا
recreation,آسائش  ـ آرام ـ تفريح
recreative,فرحت افزا
recrement,پھوک ـ فضله ـ کثافت
recriminate,الٹي تهمت لگانا ـ الٹا الزام دينا ـ ترکي به ترکي جواب دينا
recrimination,الٹي تهمت
recriminative,الزامي
recriminator,الٹي تهمت لگانے والا
recriminatory,الزامي
recross,دوباره پار کرنا
recrudesce,پھر پھوٹ پڑنا ـ پھر زور هونا
recrudescence,پھر زور پکڑنا
recrudescent,دوباره زور پکڑنے والا
recruit,نئي بھرتي کرنا ـ تقويت دينا ـ تازه دم کرنا
recruiter,نئي بھرتي کرنيوالا
recruitment,نئي بھرتي
rectangle,مستطيل
rectangular,قائم الزاويه شکل کا
rectifiable,اصلاح پذير ـ قابل تلافي
rectification,تصحيح ـ اصلاح
rectifier,تلافي کرنيوالا ـ اصلاح  کرنے والا
rectify,درست کرنا ـ غلطي دور کرنا ـ ٹھيک کرنا
rectilinear,خط مستقيم
rectitude,راستيـ راست بازي ـ سچائي
rector,حلقه کا پادريـ مدرسه کاصدر ـ ناظم
rectorate,رکٹر کا عهده
rectorship,رکٹر کا منصب
rectory,پادری کا مکان ۔
rectum,بڑي انتري کا آخري حصه ـ مقعد
recumbency,ليٹا هوا هونا ـ تکيه لگانا ـ استراخت
recumbent,تکيه لگانے هوئے ـ جھکا هوا
recuperate,صحت يا توانائي حاصل کرنا ـ تندرست هو جانا ـ سنبھل جانا
recuperation,شفايابي ـ صحتيابي
recuperative,تلافي نقصان کے متلعق ـ بازيابي کا
recur,دوباره خيال آنا ـ عود آنا ـ پھر واقع هونا
recurrence,باربار واقع هونا
recurrent,ره ره کر هونے والا ـ متواتر واقع هونے والا
recurrently,پيچھے مڑتے هوئے ـ باربار
recurvate,پيچھے کو جھکا هوا ـ خميدگي ـ پيچھے کي طرف جھکاؤ
recurvature,الٹي موڑ ـ خميدگي
recurve,پھر سے جھکانا ـ پيچھے مڑنا
recusancancy,عدولي حکمي ـ سر کشي
recusance,عدولي حکمي ـ سرکشي
recusants,کليسائے انگلستان کا منکر ـ سر کش
red,سرخ ـ لال ـ احمري ـ قرمزي ـ خون کے رنگکا
redact,اشاعت کيلئے تيار هوناـ کتاب کي تدوين کرنا
redaction,تدوين ـ تاليف
redactor,تدوين کرنے والا
redbook,فہرست مضامین ۔
redchalk,گيرو
redden,لال هوجانا ـ سرخ هوجانا
reddish,سرخ گوں
reddition,صفائي ـ درستي ـ بچاؤ ـ لڑنے والوں کو عليحده کرنا
reddle,لال مٹي
redecorate,دوباره سجانا
redeem,چھڑا لينا ـ واپس لينا ـ پھر سے خريد لينا ـ بچانا ـ نجات دلانا
redeemable,اصلاح پذير
redeemer,حضرت عيسي عليه السلام کا لقب ـ شفيع
redemand,دوباره مطالبه کرنا
redemption,محلفي ـ تلافي ـ خلاصي ـ کفاره ـ چھٹکارا
redemptive,کفاره گناه کا ـ تلافي کا
redescribe,دوباره بيان  کرنا
redesign,دوباره ڈيزائن کرنا
redevelop,دوباره ترقي دينا
redeveloper,دوباره ترقي دينيوالا
redeye,لال آنکھيں ـ شرابي آنکھيں
redhanded,جرم کرتے هوئے ـ موقعه پر ـ رنگے هاتھوں
redingote,عورتوں کے پهننے کا لباده اوور کوٹ
redintegrate,دوبره مکمل کرنا ـ مرمت کرکے اصلي حالت پر لانا ـ تجديد کرنا
redintegration,عمل ترميم ـ اصلي حالت پر لانا ـ تجديد
redirect,نئي هدايت دينا ـ دوسرے پته پر روانه کرنا
rediscount,دوباره رعايت کرنا
rediscover,پھر پالينا ـ دوباره دريافت کرنا
rediscovery,دوباره وصولي
redistribute,پھر تقسيم کرنا ـ پھر بانٹنا
redistribution,دوباره تقسيم
redivide,دوباره تقسيم کرنا
redness,انقلاب پسندي ـ لالي
redo,پھر سے کرنا ـ دوباره کرنا
redolence,تيز خوشبو ـ خوشبو
redolent,کسي کي ياد دلانے والا ـ خوشبودار
redouble,تاش ـ ڈيل کو ري ڈبل کرنا
redoubt,قلعه کا اندروني حصه
redoubtable,دهشت انگيز ـ خوفناک
redound,فاضل هونا ـ سوا هونا ـ زياده هونا ـ لوٹنا ـ حق دينا
redress,ٹھيک کرناـ درست کرناـ چاره سازي کرناـ خرابي دور کرنا ـ تلافي کرنا ـ داد رسي کرناـ حق دينا
redresser,ٹھيک کرنے والا ـ تدراک کرنے والا
redtape,دفتري ضابطه کي سخت پابندي
redtapism,دفتري کاروائي کي  رسمي پابندي
redtapist,دفتري قاعدوں کا پابند ـ لکير کا فقير
reduce,گھٹانا ـ کمي کرنا ـ کمزور کرنا ـ طاقت کم کرنا
reducer,کم کرنے والاـ گھٹانے والا
reducible,جس کو مغلوب کيا جا سکے ـ تخفيف کے قابل ـ قابل تحويل
reduction,تخفيف ـ تقليل ـ کمي ـ منهائي ـ تسخير
redundance,فضول يا زائد هونا ـ بھتات
redundancy,فضول هونا ـ زائد هونا
redundant,زائد ـ فضول ـ حشو
redundantly,بھرتي کے طور پر ـ فروائي سے
reduplicate,دگنا کرنا ـ دو چند کرنا ـ دهرا کرنا
reduplication,دو چند يا دونا هونا ـ هو بھو تقليں ـ حرف کي تکرار
reecho,گونجنا ـ صدا پيدا کرنا ـ صدا کو دهرانا
reed,نرسل ـ سرکنڈه ـ بے ـ بانسر ي ـ مرليـ منهال لگانا
reediness,سرکنڈے کي کثرت
reeding,ايک يورپي پرنده جس کي داڑھي هوتي هے
reedy,سر کنڈا بھرا ـ نے کا
reef,چٹانوں کا سلسله ـ ياد بانچه لپيٹنا
reefer,بادبانی کا کام کرنے والا ۔ ناخدا ۔ مدد گار کپتان ۔
reek,بخارات نکلنا ـ دھواں نکلنا
reeker,بو دينے والا
reel,اٹيرنا ـ چرخي پر چڑھانا ـ لڑکھڑانا ـ بے قابو هونا
reelect,ايک شخص کو دوباره منتخب کرنا
reelection,دوباره انتخاب
reelingly,چکراتے يا لڑکھڑاتے هوئے
reembark,جھاز پر بھر سوار هونا
reemerge,پھر ظهور هونا ـ پھر برآمد  هونا
reenact,مقرر قانون بنانا ـيا جاري کرنا ـ دوباره کھيل دکھانا
reenjoy,دوباره لطف اندوز هونا
reenter,دوباره داخل هونا
reentrance,دوباره داخله
reentry,پھر داخل هونا
reestablish,دوباره مستحکم هونا
reeve,جھاز کے کنڈے ميں رسي ڈالنا ـ سيندھنا ـ عامل ـ حاکم ـ ضلع کا صدر
reexamination,دوباره امتحان لينا
reexamine,دوباره امتحان لينا
reexchange,دوباره تبديل کرنا
reexhibit,دوباره منع کرنا
refection,کام کے بعد کا کھانا ـ آرام
refectory,کھانے کا کمره ـ طعام خانه
refer,استصواب کرنا ـ صلح لينا ـ مشوره ليناـ حواله دينا ـ دريافت کرنا
referable,قابل اصلاح ـ دريافت کرنے کے قابل
referee,ثالٹ ـ منصف ـ کھيل کا نگراں
reference,حواله  ـ استصواب ـ رجوع ـ تعلقـ استفسار
referendary,وه عهده دار جو بادشاه يا پوپ کے طرف سے درخوستوں کا جواب دے ـ رپورٹ کرنے والا ـ مشير عدالت
referendum,رائے دھندگان سے کسي معامله ميں براه راست استصواب
refill,دوباره بھرنا
refillable,دوباره بھرنے کيقابل
refine,صاف کرنا ـ مصفا کرنا ـ خالص بنانا ـ ميل دور کرنا
refinement,شستگي ـ صفائي  ـ آراستگي ـ نزاکت
refiner,صاف کرنے والاـ مصفا کرنے والا
refinery,تيل صاف کرنے کا کارخانه
refit,مرمت کرنا ـ درست کرنا ـ پھر ٹھيک کرنا
reflation,مقدار زر يا سکه جاريه کو اپني اصلي حالت ميں لاکرپھر مصنوعي طريقوں سے اس ميں  اضافه کرنا
reflect,منعکس کرنا ـ عکس ڈالنا ـ مظهر هونا
reflection,انعکاس ـ منعکس
reflective,مستغرق ـ متفکر ـ خيال ميں ڈوبا هوا
reflectively,غور و فکر سے
reflectiveness,غور وخوض ـ سنجيدگي
reflector,عکس انداز ـ عکس ڈالنے والا آله
reflex,عکس ـ پرتو ـ مظهر
reflexibility,عکس اندازي ـ انعکاس
reflexible,انعکاس پذير ـ عکس انداز
reflexive,فعل معکوس ـ جو فاعل کي طرف راجع هوا
refloat,غرق شده کشتي کو دوباره ترانا ـ قابل سفر بنانا
refluence,جزر ـ پاني کا اتار
refluent,اتار پر ـ اترتا هوا پاني ـ الٹا نهنے والا
reflux,جزر ـ بھٹا ـ اتار
reforest,پھر سے جنگل لگانا
reforestation,دوباره جنگل بنانا
reform,سياسي اصلاح کرنا يا هونا ـ درست کرناـ مهذب بنانا ـ پھر مرتب کرنا
reformable,درست کرنے قابل ـ مرتب کرنے کے قابل
reformation,درستي ـ اصلاح عمل
reformative,تجديدي ـ اصلاحي
reformatory,اصلاحي ـ تاديبي
reformer,اصلاح کا حامي ـ اصلاح کرنے والا
refract,متفرق کرنا ـ منتشر کرنا ـ راه راست سے پھير دينا
refraction,انعطاف ـ شعاعوں کا انتشار
refractor,شعاعوںکو موڑ دينے والا ـ شيشه ـ شعاع کش شيشه
refractorily,سختي سے ـ متمردانه ـ سرکشانه
refractoriness,انحراف ـ تمرد
refractory,سر کش ـ متمرد ـ منحڑف ـ پھرا هوا
refrain,روکن اـ باز رکھنا ـ ضبط کرنا ـ ترک کرنا
refrangibility,انحراف شعاع
refrangible,موڑے جانے کے قابل ـ مڑنے والي ـ انعطاف
refreeze,دوباره منجمد کرنا
refresh,آرام دينا ـ تازه دم کرنا ـ جان ميں جان آنا
refresher,فرحت بخچنے والا ـ تازه دم کرنے والا
refreshingly,فرحت بخش طور پر
refreshment,آرام ـ آسائش ـ ترو تازگي ـ کھانے پينے کي هلکي چيزيں
refrigerant,ٹھنڈا کرنے والا ـجمانے والا
refrigerate,مجمد کرنا ـ جمادينا ـ سر کر دينا ـ حرارت دور کرنا
refrigeration,ٹھنڈا هو جا نا ـ جمنا ـ سرد کرنے کا عمل
refrigerator,براده ـ خشک ساز آله ـ ٹھنڈا کرنے والي الماري
refrigeratory,ٹھنڈا کرنے والا ـ ٹھنڈا کرنے کا ظرف
refuge,جائے پناه ـ امن ـ پناه
refugee,پناہ گیز ۔ مہاجر ۔ پناہ گزین ۔
refulgence,نور ـ روشني ـ درخشاں
refulgent,تابان ـ روشن ـ منور
refund,واپس کرنا ـ لوٹا دينا
refundable,واپس کرنے کے قابل
refunder,واپس کرنے والاـ لوٹا دئنے والا
refundment,رقم کي واپسي ـ باز ادائي
refurbish,دوباره صقيل کرنا  ـ چمکانا
refurnish,نئے ساز وسامان سے آراسته هونا
refusable,نامنظور کرنے کے لائق ـ واپس کرنے کے قابل
refusal,ناپسنديدگي ـ کورا جوابي ـ نامنظوري
refuse,انکار کرنا ـ نامنظوري کرناـ قبول نه کرنا
refuser,انکار کرنے والا ـ قبول نه کرنے والا
refutable,جھٹلانے کے قبل ـ قابل ترديد
refutals,ترديد
refutation,ترديد
refute,جھوٹا ثابت کرنا íـ جھٹلانا ـ غلط ثابت کرنا
refuter,جھٹلانے والا ـ غلط ثابت کرنيئ والا
regain,پھر پانا ـ پھر حاصل کرنا
regainer,پھرحاصل کرنے والا
regal,شاهانه ـ خسروي
regale,دعوت کھانا ـ پرتکلف دعوت ميں شريک هونا ـ خوشبو ـ ذائقه ـ دعوت کرنا
regalement,خاطر مدارت
regalia,شاہی اختیارات ۔ شاہا نہ لوازمات ۔ شاہی سازوسامان ۔
regalism,يه عقيده که بادشاه ديني معاملات ميں واجب الاطاعت هيں
regality,شاهي اختيارات ـ لوازمات سلطنت
regard,ديکھنا ـ لحاظ کرنا ـ ادب کرنا ـغور کرنا ـ دھيان ميں لانا
regardful,احترام کرنے والا
regardless,بے فکر ـ بے ادب ـ قطع نظر
regatta,کشتي راني کا مقابله
regelate,پھر جم جانا ـ برف کا پگھل کر پھر جم جانا
regency,نيابت شاهي ـ منتظمين سلطنت
regenerate,پھر پيدا کرنا ـ نيا جنم دينا ـ زندگي بخشنا
regeneration,نئي زندگي ـ هدايت يافتگي
regenerative,روح پرور ـ اصلاحي
regenerator,پھر پيدا کرنے والا ـ اصلاح کرنے والا
regent,نائب رياست ـ بادشاه کا قائم مقام
regerminate,پھر پھوٹنا ـ پھر نکل آنا
regicide,شاه کش ـ شاه کشي
regie,حکومت کي اجاره داري
regild,دوباره سونے کا ملمع چڑھانا
regime,حکومت ـ نظام عهد
regimen,ڈھنگ ـ قاعده ـ علاج کا ايک دور ـ حکومت
regiment,ايک هزار سپاهيوں کا دسته
regimental,فوج کا ـ رجمنٹ کا
regimentation,گروه بندي کرنا ـ انتظام کرنا ـ لشکر بنانا
regina,ملکه وقت ـ فرمانروا
reginal,خطے کا ـ اقليم کا ـ علاقائي
region,اقليم ـ رياست ـ ديس
regional,خطے کا ـ اقليم کا
register,درج کرنا ـ اندراج کرنا ـ فهرست ميں شامل کرنا ـ ياد رکھنا ـ داخله لينا
registerable,درج کرنا کے قابل ـ ياد رکھنے کے قابل
registerer,درج کرنے والا ـ ياد رکھنے والا
registership,محافظ دفتري
registrable,قابل اندراج
registrar,رجسٹرارò
registrarship,محافظ دفتري
registration,داخله ـ اندراج
registry,اندراج ـ داخله
regnal,بادشاه کے دور حکومت کے متعلق
regnancy,حکومت ـ اقتدار
regnant,مقبول عام ـ مروجه
regorge,نگلنا ـ پھوٹ پڑنا ـ ابلنا ـ پھر کها جانا
regrant,پھر عطا کرنا
regrate,بازار ميں کوئي جنس خريد کر وهيں زياده داموں  ميں بيچنا ـ پتھر  اوپر سے چھيلنا
regress,مراجعت کرنا ـ پھر جانا ـ پلٹ جانا
regression,واپسي ـ باز گشت
regressive,رجعت پسندانه ـ رجعت ميں
regressiveness,رجعت ـ واپسي
regressor,مراجعت کرنے والا ـ پلٹ جانے والا
regret,افسوس کرنا ـ پچھتانا ـ ملول کرنا ـ ادس هوناò
regretable,قابل افسوس
regretful,غمگین ۔
regretfully,افسوس کيساتھ
regretfulness,حسرت ـ ملال ـ ندامت
regroup,از سر نو نوگروه بندي کرنا
regular,باقاعدهـ باضابطه ـ برابر ـ حسب معمول ـ حسب دستور
regularity,همواري ـ پابندي وقت ـ باقاعدگي ـ يکسانيت
regularization,باضابطه کرنا ـ باقاعده بنانا
regularize,وقت کا پابند کرنا ـ اصول کے تحت لانا
regularizer,وقت کا پابند کرنے والا
regularly,حسب معمول
regulate,باقاعده کرناـ پابند کرنا ـ ٹھيک کرنا
regulation,قانون ـ ضابطه ـ حکم
regulative,ترتيبي ـ تنظيمي
regulatively,باقاعدگي
regulator,حرکت کو منظم کرنے والا ـ باقاعده رکھنے والا پرزه
reguline,بغير صاف کي هوئيـ خام دھات
regulus,کچي دھا ت ـ مرکب دھات
regurgitate,اگل دينا ـ پيچھے کو بھنا
rehabilitate,بحال کرنا ـ سابقه حالت پر لانا ـ پھر آباد کرنا
rehabilitation,سرفرازي ـ بحالي
rehabilitator,بحال کرنے والا ـ سابقه حالت پر لانے والا
rehandle,پھر کام لينا ـ دوباره استعمال ميں لانا
rehash,پراني چيزوں کو نيا بنا کر پيش کرنا
rehear,مقدمه کي از سر نو سماعت کرنا
rehearsal,باز خواني ـ مکرر خواني ـ مشق ـ حفظ کيا هوا بيان سنانا ـ اعاده
rehearse,دھرانا ـ دوباره سنانا ـ دوباره کهنا
rehearser,دوباره کهنے والا
rehumanize,پھر سے انسان بنانا ـ انسانيت پيدا کرناـ پھر سے مهذب بنانا
reich,جرمني کي جمهوري حکومت
reicharath,آسٹريا کي پارليمنٹ
reichstag,ريشاخ ـ جرمني کي پارليمنٹ
reified,مشکل کر دينا
reify,مشتکل کر دينا ـ کسي غير مرئي هستي کو مادي شکل دينا
reign,رياست حکومت ـ راج ـ عمداري ـ بادشاهت کرنا ـحکومت کرناـ چھايا هواـ سلطنت کرنا
reigningbeauty,حسينه روزگار ـ ملکه جھاں
reignite,دوباره جلانا ـ دوباره آگ لگانا
reimbursable,واپس کرنے کے قابل
reimburse,واپس کرنا ـ لوٹا دينا ـ نقصان کا معاوضه دينا ـ پورا کرنا ـ روشن کرنا
reimburseable,پورا کرنے کے قابل ـ واپس کرنے کے قابل
reimbursement,بے باقي ـ واپسي ـ تلافي
reimport,بھيجتے هوئے مال کو بھر منگانا ـ برآمدشده مال کو پھر درآمد کرنا
reimpose,پھر عائد کرنا ـ دوباره نافذ کرنا
rein,باگ دوڑ ـ لگام ـ عنان ـ راس ـ اختيار ـ عنان حکومت
reincarnate,دوباره جنم دينا ـ دوباره وجود دينا
reincarnation,از سر نو توليد و تجسيم ـ دوسرا جنم ـ اوتار
reindeer,ایک کا قطبی ہرن ۔
reinforce,مدد پهنچانا ـ کم دينا ـ مضبوط کرنا
reinforcement,مدد ـ زائد امداد ـ کمک ـ امداي فوج
reinforcer,مدد دينے والا
reinform,دوباره اطلاع دينا
reingratiate,دوباره رسوخ پانا ـ پھر منظور نظر هو جانا
reinjured,دوباره زخمي هونا
reink,پھر سياهي پھرنا ـ پھر سياهي سے لکھنا
reinless,بے قابو ـ بے لگام
