unzealous,جو سرگرم نه هو
up,اوپر ـ بالا ـ اوپر کي طرف ـ اوپر تک
upas,ملک جاوا کا ايک درخت جس سے تيز زهر آلود کيے جاتے هيں ـ سميت
upbraid,ملامت کرناـ سرزنش کرنا ـ جھڑکنا
upbraiding,سرزنش ـ ملامت
upbraidingly,جھڑکياں ديتے هوئے
upbringing,تربيت ـ تعليم
upcountry,اندروں ملک کا
upheaval,انقلاب عظيم
uphill,بلندي کي طرف ـ دشوار
uphold,اوپر اٹھاناـ بلند کرنا ـ برقرار رکھنا
upholder,بلند رکھنے والا ـ برقرار رکھنے والا
upholster,غلاف چڑھانا
upholsterer,صوفے بنانے والا ـ پردے غلاف بيچنے والا
upholstery,صوفه سازي
upkeep,نگهداشت ـ خير گيري
uplift,اخلاقي يا دنياوي ترقي ـ اصلاح کرنا
uplifter,اصلاح کرنيوالا
upon,اوپر ـ سطح کے اوپر ـ اس کے بعد
upper,بالاتر ـ اوپر کا ـ بالائي
uppermost,سب سے اونچا
uppish,اچھلا هو اـ مغرور
uppishly,گستاخي سے غرور سے
uppishness,گستاخي ـ تمرد
upright,سيدھا ـ عمودي ـ مستقيم
uprightness,ديانت داري
uprising,شورش ـ بغاوت
uproar,هنگامه ـ فساد ـ شور و غل
uproarious,قهقهوں کا ـ شورش پسند
uproariousness,هنگامه خيزي
uproot,جڑ سے اکھاڑ پھينکا
uprooter,جڑ سے اکھاڑنے والا
upset,اوندھا کر دينا ـ الٹ کر دينا ـ پريشان کرنا
upsetter,پريشان کرنے والا ـ اوندھا کرنے والا
upshot,نتيجه ـ خاتمه ـ اختتام ـ انجام ـ ماحضل
upsidedown,اوپر تلے ـ درهم برهم
upstairs,بالا خانه ـ اوپر کي منزل
upstart,نودولتا ـ چھچھورا
upstream,دريا کے بالائي رخ پر
uptake,سمجھ ـ فهم
upturn,جوتنا ـ هل چلانا
upward,اوپر کي طرف ـ بلند
uraemia,گودوں اور مٹانے کا فعل خراب هو نے کي وجه سے خون کي سميت
uraeus,ناگ کا سرپيچ ـ ناگ کا طره
uranium,ايک ريڈياني دھات
uranous,مرکب جس ميں آکسيجن کم هوـ يورينيم کا
uranus,يورينس کا ايک سياره جس کو هرشل نے دريافت کيا تھا يه همارے نظام شمسي کا بعيد ترين سياره هے صرف نيپٹون اس سے زياده دور هے
urb,عرب
urban,شهري
urbane,خليق ـ خوش خلق
urbanity,تهذيب ـ انسانيت ـ خوش خلقي
urbanization,مضافات ميں شهر کا رنگ پيدا کرنا
urbanize,شهريت پيدا کرنا
urchin,شيرير لڑکا ـ خار پشت
urdu,اردو زبان ـ پاکستاني قوم کي زبان ـ پاک و هند کے شرفأ کي زبان
ureter,نالي جو گردوں سے پيشاب مٹانه ميں لے جاتي هے
ureteritis,ورم اور سوزش مثانه
urethra,مثانه سے پيشاب کے اخراج کي نالي
uretic,پيشاب آور دوا
urge,آگے بڑھانا ـ چلانا ـ مجبور کرنا ـ ترغيب دينا
urgency,ضرورت ـ لاچاري ـ بے حد اصرار
urgent,فوري تعميل طلب ـ لازمي ـ اشد ـ ضروري ـ تاکيدي
urgently,شديد اصرار سے ـ نهايت تاکيد سے
urger,مجبور کرنے والا ـ آگے بڑھانے والا
uric,پيشاب کے قاورے کے متعلق
uricacid,پيشاب کا تيزاب يا ترشه
urinal,پيشاب دان ـ مريضوں کے پيشاب کرنے کا ظرف
urinary,پيشاب کے متعلق
urinate,پيشاب کرنا
urination,پيشاب هونا  يا کرنا
urine,پيشاب
urn,تنگ دھانے کا گول برتن ـ کوزه ـ خاک دان ـ پھول دان
urnflower,ايک پودا  جس ميں کوزه کي شکل کا پھول آتا هے
ursa,قطب شمالي کے قريب ستاروں کے جھرمٹ جو چھوٹے بڑے ريچھ کهلاتے هيں
ursamajor,دب اکير
ursamonor,اب اصغر
ursine,خرسي ـ ريچھ کي طرح کا
ursuline,اس جماعت کي راهبه جو لڑکيوں کي تعليم کيلئے سينٹ ارسولا کے نام پر قائم کي گئي تھي
urticate,بچھورا پودے کي شاخ سے مارنا تاکه سن عضو ميں حس پيدا هو جاتے
urus,جنگلي سانڈ ـ ارنا بھينسا
us,هميں ـ هم کو ـ اپنے آپ کو
usage,محاوره ـ دستور
usance,مدت ـ ميعاد ـ معياد ادائيگي
use,کام ميں لانا ـ استعمال کرنا ـ عمل ميں لانا ـ مصرف ـ فائده
useable,قابل استعمال
useful,مفيد ـ کارآمد ـ بھت عمده
usefully,مفيد طريقے سے
usefulness,فائد ه مندي
useless,بے فائد ه ـ بے کار
user,استعمال کرنے والا
usher,حاجب ـ نقيب ـ خليفه ـ دريان
ushership,نقيب کا عهده
usual,معمولي ـ حسب معمول ـ حسب رواج
usually,حسب عادت هونا ـ حسب معمول هونا
usualness,حسب عادت هونا
usucaption,طويل قبضه کي بنا پر حق ملکيت
usufruct,حق استعمال و استفاده بلا ملکيت ـ نزولي جائداد
usurapation,دست درازي ـ تعديلي
usurer,بھاري شرح سود پر قرض دينے والا
usurious,بھاري سود پر قرض  دينے والا
usuriousness,بھاري سود خوري ـ ظالمانه سود خوري
usurp,قبضه ـ بالجبر کرنا
usurper,دبا بيٹھنے والا ـ بالجبر قبضه کرنے والا
usury,سود خوري ـ بھاري سود
utensil,آله ـ اوزار ـ ظرف
uterine,رحم کے متعلق ـ رحمي
uteritis,رحم کا ورم
uterus,رحم ـ بچي دائي
utilise,استفاده کرنا ـ فائد ه اٹھانا
utilitarian,افاديت پسند ـ افاديت کا
utilitarianism,نظريه اخلاقيات
utility,افاديت ـ افادي عام
utilizable,قابل استفاده
utilization,استعمال ـ کام ميں لانا
utilize,استعمال ـ کام ميں لانا
utilizer,کام ميں لانے والا ـ استعمال کرنے والا
utmost,نھايت ـ ازحد
utopia,مثالي رياستد
utopian,بلند رتصورارت کا بے عمل شخص ـ خيالي ـ مثالي
utopianism,تصور پرستي ـ خيال پرستي
utter,بالکل ـ سارا ـ انتهائي ـ زبان سے نکلنا ـ قلم سے ادا کرنا ـ چينخ مارنا ـ منه سے کهنا
utterance,اظهار خيالات ـ اظهار
utterbarrister,دوسرے درجے کا وکيل
utterer,اظھار کرنے والا
utterly,بالکل ـ قطعا
uttermost,بے حد ـ انتهائي
utterness,انتهائي هونا
uvula,حلق کا کوا
uxorious,بيوي کا ديوانه
uxoriousness,زن پرستي
uzbeg,ازبک ـ وسط اشيا کي ترک قوم ـ ترکي قوم کا فرد
